id,URL,party,timestamp,type,message,link,comments_count,shares_count,reactions_count,like_count,love_count,wow_count,haha_count,sad_count,angry_count
235,https://www.facebook.com/CSU/posts/10157129269815688,CSU,2019-05-07T15:15:00Z,photo,Heute Abend um 20:15 Uhr ist unser Spitzenkandidat zur Europawahl Manfred Weber in der ARD-Wahlarena und diskutiert mit Frans Timmermans von den Sozialdemokraten. Einschalten lohnt sich! #CSUtvTipp #wahlarena,https://www.facebook.com/CSU/photos/a.311521140687/10157129256085688/?type=3,138,32,317,172,1,3,79,0,62
236,https://www.facebook.com/alternativefuerde/posts/2402928149737510,alternativefuerde,2019-05-07T12:13:00Z,photo,"++ Paukenschlag in Budapest: Orban lässt Spitzenkandidat Weber fallen! ++  Es tut sich was auf der patriotischen Ebene in Europa! Viktor Orban entzieht dem Spitzenkandidaten der konservativen Parteienfamilie EVP Manfred Weber das Vertrauen.  Ein schwerer Schlag für den weitgehend unbekannten deutschen Kandidaten, der unter anderem „ein umfassendes Resettlement-Programm“ fordert. Die Moralkeule zückend stellt er fest: Europa könne nicht weiter in Wohlstand leben, während Afrika im Chaos versinke. Konkret will er der dafür ursächlichen Bevölkerungsexplosion dadurch beikommen, großzügig Afrikaner in Europa aufzunehmen. Was mit ihm auf den Chefsessel des EU-Kommissionspräsidenten einziehen könnte, lässt einem die Haare zu Berge stehen!  Das ist auch Ungarns Premierminister Viktor Orban längst klar. Während einer Pressekonferenz in Budapest sagte er, Weber habe klargemacht, dass er nicht mit den Stimmen der Ungarn Präsident der EU-Kommission werden wolle. Dies schließe jede weitere Unterstützung für ihn aus. Für die konservative EVP-Fraktion, der Orban noch angehört, ein Tiefschlag. Immer mehr EU-Staaten wenden sich ab und organisieren sich in der neu ins Leben gerufenen patriotischen Fraktion.  Für diese haben neben den Gründungsmitgliedern Italien (Lega - Salvini Premier), Deutschland (AfD), Dänemark (Dansk Folkeparti) und Finnland (Perussuomalaiset), ebenso auch Österreich (FPÖ), Estland (Eesti Konservatiivne Rahvaerakond), Frankreich (Rassemblement National), Belgien (Vlaams Belang und die Slowakei (Sme rodina) zugesagt. Tritt nun auch in Kürze Orban bei? Die Chancen stehen besser denn je. Damit erhalten die patriotischen Kräfte weiteren Auftrieb, können im EU-Parlament mit starker Stimme sprechen.  Wählen Sie am 26. Mai die AfD.   Hier finden Sie alle Infos zur Europawahl, dem Wahlprogramm und unseren Kandidaten: ➡ https://www.afd.de/europawahl ➡ https://www.afd.de/europawahl-kandidaten   https://www.t-online.de/nachrichten/ausland/eu/id_85705186/ungarn-premier-orban-entzieht-weber-und-evp-unterstuetzung-fuer-europawahl.html",https://www.facebook.com/alternativefuerde/photos/a.542889462408064/2403025676394424/?type=3,500,1279,6178,5712,310,14,140,0,2
237,https://www.facebook.com/CDU/posts/10156348611905415,CDU,2019-05-07T20:26:42Z,photo,"Bodenständig, unaufgeregt und mit klaren Vorstellungen. Manfred Weber ist der richtige Mann für #Europa.  In der #Wahlarena hat unser Spitzenkandidat deutlich gemacht, für welches Europa CDU und CSU (Christlich-Soziale Union) Verantwortung übernehmen wollen. Für Deutschlands Zukunft: #UnserEuropa schafft Wohlstand, gibt Sicherheit und sichert Frieden. #26MaiCDU",https://www.facebook.com/CDU/photos/a.438118535414/10156348607945415/?type=3,270,135,927,722,7,1,141,3,53
238,https://www.facebook.com/freie.waehler.bundesvereinigung/posts/1269299729888717,freie.waehler.bundesvereinigung,2019-05-07T16:00:01Z,link,"Menschheitsaufgabe Artenschutz:  FREIE WÄHLER gehen mutig voran. Es ist lokales und globales Handeln nötig. Unser Bundesvorsitzender Hubert Aiwanger Freie Wähler Bundesvorsitzender und die FREIE WÄHLER Landtagsfraktion fordern eine stärkere Unterstützung privater Gartenbesitzer – so sollen z.B. Obstbäume an Bürgerinnen und Bürger verschenkt werden, damit diese ihre Gärten für den Artenschutz attraktiver machen. Auch auf EU Ebene müssen wir uns stärker für den Artenschutz einsetzen. Unsere Ziele dazu finden sie hier: https://www.unsereheimateuropa.de/unsere-politik/lebensqualitaet/ #UnsereHeimatEuropa #FREIEWÄHLER #Artenvielfalt",https://www.tagesschau.de/ausland/artenvielfalt-weltbericht-101.html,3,25,49,43,2,1,0,3,0
239,https://www.facebook.com/FDP/posts/10157236373242250,FDP,2019-05-07T10:04:52Z,photo,"Wir wollen Europas #ChancenNutzen 🚀 und mit den Menschen ins Gespräch kommen.   Am #ChancenTag am vergangenen Wochenende haben sich über 100 Orts- und Kreisverbände beteiligt und die Bürgerinnen und Bürger digital über ihre Wünsche für Europa abstimmen lassen. 💪  Dabei konnten die Bürgerinnen und Bürger aus 13 Forderungen Ihr 3 Favoriten auswählen.  Klare Regeln für #Zuwanderung, #Klimapolitik europäisch gestalten und eine echte gemeinsame EU-#Außenpolitik waren die Top 3-Wünsche. 👍  Hier die genaue Aufschlüsselung:  14.39 % Klare Regeln für Zuwanderung 10.62 % Klimapolitik europäisch gestalten 10.02 % Eine echte gemeinsame EU-Außenpolitik 9.22 % Sichere Außengrenzen 9.10 % Wirtschaftspolitik für Wohlstand in Europa 8.26 % Innovationen stärker fördern 7.94 % Stabiler Euro ohne gemeinsame Schulden 6.86 % Mehr Bürgerbeteiligung in der EU 5.49 % Eine gemeinsame Europäische Armee 5.21 % Bürgerrechte in Europa stärken 5.21 % Kostenloser Schüleraustausch in ganz Europa 4.05 % Europäische Kommission verkleinern 3.97 % Berufsausbildung europäisch gestalten",https://www.facebook.com/FDP/photos/a.82276712249/10157236364672250/?type=3,23,59,276,270,2,0,1,0,3
240,https://www.facebook.com/CSU/posts/10157131425075688,CSU,2019-05-07T14:10:30Z,photo,"Bei der undurchsichtigen und undemokratischen Wahlwiederholung in Istanbul zeigt die türkische Regierung erneut ihr wahres Gesicht. Wir verstehen nicht, warum Sozialdemokraten und Grüne weiter an einem EU-Beitritt festhalten.",https://www.facebook.com/CSU/photos/a.311521140687/10157131417585688/?type=3,109,89,898,837,15,4,34,3,5
241,https://www.facebook.com/CSU/posts/10157131032885688,CSU,2019-05-07T12:12:38Z,video,"Unser Spitzenkandidat Manfred Weber zu Gast im ZDF Morgenmagazin: ""Ich glaube an technologische Lösungen, ich glaube nicht an neue Steuern, wie wir sie jetzt in Deutschland diskutieren."" Keine CO2-Steuer!",https://www.facebook.com/CSU/videos/584737078696668/,132,25,309,168,3,1,81,1,55
242,https://www.facebook.com/CSU/posts/10157131969565688,CSU,2019-05-07T18:18:24Z,video,Jetzt die #Wahlarena zur Europawahl mit Manfred Weber,https://www.facebook.com/DasErste/videos/2263833557029100/,61,9,131,70,5,2,23,0,31
243,https://www.facebook.com/FDP/posts/10157237012462250,FDP,2019-05-07T15:57:30Z,photo,"#Infrastrukturlücken, die wegen der historischen Grenzen bestehen, müssen endlich geschlossen werden. 👍  Hieraus können sich Standortvorteile sowie Vorteile für den Güter- und Personenverkehr oder für die Ansiedlung von Unternehmen ergeben.   Wir wollen, dass ein zentraler Ansprechpartner, der sowohl mit den Vorschriften und Planungs- sowie Genehmigungsverfahren diesseits und jenseits der Grenze vertraut ist, kann als #GrenzScout diese Projekte aktiv unterstützen, zum Bürokratieabbau beiträgt und Verfahren erleichtert. 💪 #ChancenNutzen 🚀 #EP2019 #Europawahl2019",https://www.facebook.com/FDP/photos/a.82276712249/10157236925312250/?type=3,9,9,100,91,8,0,1,0,0
244,https://www.facebook.com/CSU/posts/10157132153550688,CSU,2019-05-07T19:48:21Z,photo,"Klare Sache bei der #Wahlarena in der ARD:  Manfred Weber überzeugt mit starken Argumenten! Er ist der richtige Kandidat für ein starkes, smartes und menschliches Europa! Wer Zukunft will, muss Union wählen. Wer zurück in die Vergangenheit will, kann sich bei den Sozis umschauen!",https://www.facebook.com/CSU/photos/a.311521140687/10157132152900688/?type=3,292,119,1174,723,10,8,335,3,95
245,https://www.facebook.com/oedp.de/posts/10157202087364568,oedp.de,2019-05-07T06:01:25Z,link,"Jetzt auch europaweit: https://www.main-echo.de/ueberregional/politik/politikindexseite/politik-kurz/prio3/prio3/art502650,6692445?fbclid=IwAR2zRE6wzTdlf0FCK_JCVYwORkIm5qvsv6p-4QpDqA48R1SQmcZqUZYRoNQ#.XNCkqgTsl2c.facebook","https://www.main-echo.de/ueberregional/politik/politikindexseite/politik-kurz/prio3/prio3/art502650,6692445?fbclid=IwAR2zRE6wzTdlf0FCK_JCVYwORkIm5qvsv6p-4QpDqA48R1SQmcZqUZYRoNQ#.XNCkqgTsl2c.facebook",0,2,29,29,0,0,0,0,0
246,https://www.facebook.com/VoltDeutschland/posts/414504105766981,VoltDeutschland,2019-05-07T15:30:01Z,status,"Heute vor genau 10 Jahren wurde im Rahmen des Gründungsgipfels in Prag der Grundstein zur Europäischen Partnerschaft gelegt. 🎉🇪🇺 „Das Hauptziel hierbei besteht darin, die notwendigen Voraussetzungen für die Beschleunigung der politischen Assoziierung und der weiteren wirtschaftlichen Integration zwischen der EU und interessierten Partnerländern zu schaffen“, so heißt es in der entsprechenden Erklärung. Die östlichen Partnerländer sind Armenien, Aserbaidschan, Georgien, Moldau, die Ukraine und Weißrussland. Unterstützt wird dieses tolle Projekt von der Europäischen Investitionsbank (EIB).","NA",0,5,77,72,5,0,0,0,0
247,https://www.facebook.com/DiePARTEI/posts/2180475031988513,DiePARTEI,2019-05-07T18:41:25Z,link,‪Könnte das bitte jemand an die Jungs von Queer schicken? Und an die CSU? Smiley!,https://www.jetzt.de/politik/satire-gegen-homophobie-im-eu-parlament,30,67,751,688,24,3,33,3,0
248,https://www.facebook.com/linkspartei/posts/1732813883532075,linkspartei,2019-05-07T14:56:08Z,video,"Live aus Düsseldorf Bernd Riexinger, Özlem Alev Demirel, Martin Schirdewan und Sahra Wagenknecht",https://www.facebook.com/linkspartei/videos/1732813883532075/,240,95,390,303,69,1,4,1,12
249,https://www.facebook.com/CSU/posts/10157133564070688,CSU,2019-05-08T12:30:33Z,photo,"Bayern war ein Land der Ökologie und Bayern bleibt ein Land der Ökologie: Wir werden auch das Land sein, dass Landwirtschaft und Ökologie miteinander versöhnt.",https://www.facebook.com/CSU/photos/a.311521140687/10157133563785688/?type=3,41,17,212,170,1,2,30,0,9
250,https://www.facebook.com/SPD/posts/10156388911467749,SPD,2019-05-08T20:40:50Z,photo,"NA",https://www.facebook.com/SPDLandBremen/photos/a.524970407573013/2687479927988706/?type=3,74,8,191,128,5,0,55,1,2
251,https://www.facebook.com/SPD/posts/10156388067627749,SPD,2019-05-08T15:28:22Z,photo,"Wer wie Amazon, Google & Co. in #Europa 🇪🇺Gewinne erwirtschaftet, muss dafür auch Steuern zahlen! ☝️ Olaf Scholz hat dazu heute mit seinem Vorschlag einer Mindestbesteuerung einen Meilenstein für mehr Gerechtigkeit in Europa vorgelegt! Mehr: https://link.spd.de/Mindestbesteuerung #EuropaistdieAntwort",https://www.facebook.com/SPD/photos/a.73469452748/10156388066802749/?type=3,87,59,376,333,7,1,34,0,1
252,https://www.facebook.com/FDP/posts/10157239001522250,FDP,2019-05-08T13:34:57Z,photo,"Der EU-#Binnenmarkt ist der größte Handelsraum der Welt. Doch er ist noch nicht vollendet: Es besteht dringender Handlungsbedarf vor allem bei Digitales und Energie.👍  Wir fordern dazu 1️⃣ eine einheitliche rechtliche Basis und  2️⃣ gemeinsame technische Standards auf der europäischen Ebene. 💪 Dadurch können bessere Bedingungen für Verbraucherinnen und Verbraucher, mehr Wachstum, Arbeitsplätze und wirtschaftliche Stabilität erreicht werden. #ChancenNutzen 🚀 #EP2019 #Europawahl2019",https://www.facebook.com/FDP/photos/a.82276712249/10157238979132250/?type=3,14,8,90,77,10,1,1,0,1
253,https://www.facebook.com/FamilienParteiDeutschlands/posts/2237636059664748,FamilienParteiDeutschlands,2019-05-08T17:28:22Z,photo,"Heute Abend um 18:00 Uhr – Gemeinsamer Wahlaufruf von Mitgliedern des Rates der Stadt Billerbeck und der Bürgermeisterin Marion Dirks. Unter dem Motto, was in Europa entschieden wird, hat sehr oft einen Einfluss auf die Kommunen, haben die Bürgermeisterin und Ratsmitglieder der Stadt Billerbeck gemeinsam die Europaflagge gehisst. Damit sollen alle Bürger an die Europawahl am 26.05. täglich erinnert werden. Unser Spitzenkandidat Helmut Geuking, selbst Ratsmitglied in der Stadt Billerbeck, freute sich über das parteiübergreifende Interesse aller Ratsmitglieder an dieser Europawahl.",https://www.facebook.com/FamilienParteiDeutschlands/photos/a.628202820608088/2237635192998168/?type=3,2,17,9,8,1,0,0,0,0
254,https://www.facebook.com/FamilienParteiDeutschlands/posts/2237509576344063,FamilienParteiDeutschlands,2019-05-08T15:39:17Z,photo,"Heute in Haltern am See. Obwohl das Wetter gerade nicht so prickelnd war, haben wir uns heute gut präsentiert. Einige Bürger ließen sich auch vom Regen nicht abschrecken, um die Gelegenheit zu nutzen sich direkt bei unserem Spitzenkandidaten über unsere Europapolitik zu informieren. Insbesondere interessierten sich die Menschen für die europäische Klimapolitik und Sozialpolitik. Nicht nur in Haltern am See wurden Ängste deutlich, dass populistische Parteien die Zukunft unserer Kinder und Enkelkinder gefährden.  Unsere FAMILIE wird zunehmend wahrgenommen als eine echte Alternative in der Parteienlandschaft!",https://www.facebook.com/FamilienParteiDeutschlands/photos/a.628202820608088/2237508396344181/?type=3,1,22,21,20,1,0,0,0,0
255,https://www.facebook.com/alternativefuerde/posts/2405045842859074,alternativefuerde,2019-05-08T15:32:26Z,video,"+++ AfD muss Abschluss in Bremen wegen Morddrohungen absagen! +++  Die für den 24. Mai geplante Abschlussveranstaltung des AfD-Europawahlkampfs in Bremen musste heute aufgrund von Morddrohungen gegen die Familie des türkischen Vermieters des Veranstaltungssaals abgesagt werden. Ebenso musste die für den 11. Mai vorgesehene Veranstaltung mit AfD-Sprecher Alexander Gauland am selben Ort ersatzlos gestrichen werden.  Die Wahlkampfveranstaltung mit AfD-Bundessprecher Prof. Dr. Jörg Meuthen  sollte auch die Abschlussveranstaltung der AfD Bremen für den Bürgerschaftswahlkampf sein. Am 26. Mai wählen die Hanseaten ihre Vertreter für das EU-Parlament und die Bremische Bürgerschaft. Im Video sehen Sie eine kurze Stellungnahme von Frank Magnitz, MdB, Spitzenkandidat der AfD Bremen zur Bürgerschaftswahl am 26. Mai.  AfD-Bundessprecher und Spitzenkandidat zur Europawahl Prof. Dr. Jörg Meuthen erklärt dazu: „Der Gesinnungsterror hierzulande nimmt immer üblere Formen an. Die Linksextremisten werden von Tag zu Tag skrupelloser. Mit der AfD muss jetzt die größte Oppositionspartei im Deutschen Bundestag die Abschlussveranstaltung ihres Europawahlkampfs in Bremen aufgrund linksextremer Bedrohungen absagen. Der Rechtsstaat kapituliert vor der Gewalt. Eine schwarze Stunde in der Geschichte unserer Demokratie. Ich fordere den Bremer Senat auf: nehmen Sie endlich das Problem der linksextremen Gewalttäter ernst und garantieren Sie einen offenen demokratischen Diskurs in Bremen.“  Video bei YouTube: https://www.youtube.com/watch?v=1BEQjAJML74  JETZT unseren Kanal abonnieren: https://www.youtube.com/channel/UCq2rogaxLtQFrYG3X3KYNww/about?sub_confirmation=1",https://www.facebook.com/alternativefuerde/videos/618852171917125/,558,2570,2263,964,12,57,23,160,1047
256,https://www.facebook.com/alternativefuerde/posts/2401985269831798,alternativefuerde,2019-05-08T06:12:00Z,video,"++ EU-Wahlkampf: Wir bestimmen selbst, wer zu uns kommt! ++  Asylrecht ist ein Recht auf Zeit. Unbedingt muss verhindert werden, dass es dafür missbraucht wird, in unser Sozialsystem einzuwandern. Das geschieht bereits seit Jahren. Den betreffenden Ländern ist damit nicht geholfen. Als AfD sind wir für nachhaltige Hilfe direkt vor Ort. Es gibt kein Menschenrecht auf ein Leben in Europa.  In unserem Wahlprogramm fordern wir, die Massenmigration zu stoppen und gezielt die Rückführungen in Angriff zu nehmen. Der UN-Migrationspakt muss aufgekündigt werden https://www.afd.de/migrationspakt-stoppen. Wir lehnen Aufnahmequoten genauso ab, wie den EU-Beitritt der Türkei. Stattdessen müssen die Grenzen gesichert und die Souveränität endlich wieder hergestellt werden. Europa muss zur Festung werden!  Wählen Sie am 26. Mai die AfD und setzen Sie ein Zeichen für ein starkes Europa der Vaterländer.  Hier finden Sie alle Infos zur Europawahl, dem Wahlprogramm und unseren Kandidaten: ➡ https://www.afd.de/europawahl ➡ https://www.afd.de/europawahl-kandidaten  Video auf YouTube: https://www.youtube.com/watch?v=Ri1-C7JqoUo  Jetzt unseren Kanal abonnieren: https://www.youtube.com/channel/UCq2rogaxLtQFrYG3X3KYNww/about?sub_confirmation=1",https://www.facebook.com/alternativefuerde/videos/2310191342635465/,451,2482,4711,4335,191,7,62,9,107
257,https://www.facebook.com/oedp.de/posts/10157204879044568,oedp.de,2019-05-08T12:22:11Z,video,"Heute Abend finden zeitgleich drei wichtige Veranstaltungen mit prominenter ÖDP-Beteiligung statt:  19:00 - 22:00 Uhr Preisverleihung der goldenen Schwalbe und Veranstaltung mit Christoph Raabs, Manuela Ripa, Jorgo Chatzimarkakis und anderen. Livestream unter: www.youtube.com/watch?v=ivaiS6wP4pg&feature=youtu.be  20:15 Uhr Klaus Buchner zu Gast in der Münchner Runde im Bayerischen Fernsehen: https://www.br.de/br-fernsehen/sendungen/muenchner-runde/index.html  19:00 Uhr Europawahlforum in Fürstenwalde - mit unserer Kandidatin aus #Brandenburg Paula Stier auf dem Podium: www.kandidaten-befragung.de",https://www.youtube.com/watch?v=ivaiS6wP4pg&feature=youtu.be,0,3,15,15,0,0,0,0,0
258,https://www.facebook.com/linkspartei/posts/10155843085560683,linkspartei,2019-05-08T07:30:13Z,photo,"Heute ist Tag der Befreiung. Das ist der Tag, an dem wir feiern können, dass der Faschismus besiegt wurde und ein Tag, der uns mahnt, uns menschenfeindlichen Ideologien entgegenzustellen.   In Europa formieren sich wieder rechte Kräfte, die für all jene zur Gefahr werden, die nicht in das Weltbild dieser rückwärtsgewandten Ideologien passen. Um so wichtiger ist es, dass wir die Erinnerung an das Elend wachhalten, welches das faschistische Deutschland zwischen 1933 und 1945 über die Menschen gebracht hat.   Der 8. Mai als bundesweiter Gedenk- und Feiertag kann Raum für das gemeinsame Gedenken bieten. Erinnerung bleibt nur lebendig, wenn sie als Teil heutiger gesellschaftlicher Diskussion erhalten bleibt.",https://www.facebook.com/linkspartei/photos/a.60691390682/10155843136530683/?type=3,195,782,3567,3302,210,10,30,6,9
259,https://www.facebook.com/oedp.de/posts/10157204665689568,oedp.de,2019-05-08T09:59:00Z,photo,"Heute vor 70 Jahren wurde der Entwurf des Grundgesetzes, unsere #Verfassung, angenommen. Trotz des Artikels 146 ist das #Grundgesetz nie den Bürgern zur Abstimmung vorgelegt worden. Wir bedauern das, denn wir glauben an unsere Verfassung und daran, dass die Bürgerinnen und Bürger sie beschließen würden. #ÖDP #GG",https://www.facebook.com/oedp.de/photos/a.393610334567/10157204665689568/?type=3,6,25,45,39,0,6,0,0,0
260,https://www.facebook.com/CSU/posts/10157134630180688,CSU,2019-05-08T21:56:24Z,photo,Ein EU-Beitritt der Türkei ist keine Option! #Klartext unseres Spitzenkandidaten zur Europawahl Manfred Weber,https://www.facebook.com/manfred.weber/photos/a.607854129252955/2291945260843825/?type=3,128,32,722,597,10,4,101,0,10
261,https://www.facebook.com/B90DieGruenen/posts/10158294748593219,B90DieGruenen,2019-05-08T06:00:01Z,photo,"Am 8. Mai 1945 endeten die Kampfhandlungen in Europa. Ein Tag der Befreiung. Ein Tag, der uns mahnt, immer weiter an einem friedlichen Europa zu bauen.",https://www.facebook.com/B90DieGruenen/photos/a.103764373218/10158294747853219/?type=3,74,637,1597,1446,126,2,18,0,5
262,https://www.facebook.com/SPD/posts/10156388170312749,SPD,2019-05-08T16:05:06Z,photo,"Bremen hat 2012 als 1. Bundesland einen Landesmindestlohn eingeführt & ihn jetzt auf 11,13€ erhöht! SPD Land Bremen geht voran! Ein wichtiger Schritt auf unserem Weg zu 12€ Mindestlohn in Deutschland – und einem europäischen Mindestlohn! #EuropaistdieAntwort",https://www.facebook.com/SPD/photos/a.73469452748/10156388156757749/?type=3,93,57,592,526,25,4,36,1,0
263,https://www.facebook.com/Piratenpartei/posts/10157311271052783,Piratenpartei,2019-05-08T04:04:23Z,video,"Die Piratenpartei Baden-Württemberg hat anlässlich der Europwahl und der gleichzeitigen Kommunalwahl in Baden-Württemberg eine aktuelle Version von ""Ich bin Pirat"" gedreht. ""ich bin Pirat"" war der erste Fernsehspot der Piratenpartei zur Bundestagswahl 2009. 💜🧡💜🧡 #Gehtwählen #Europawahl   https://www.youtube.com/watch?v=kesKJLOCWSs",https://www.youtube.com/watch?v=kesKJLOCWSs,14,27,45,38,1,0,5,1,0
264,https://www.facebook.com/VoltDeutschland/posts/415422129008512,VoltDeutschland,2019-05-08T16:41:06Z,status,"In der aktuellen Ausgabe der Zeitschrift für Internationale Politik der betont Sophie Pornschlegel von ""Das Progressive Zentrum"" die Einflussmöglichkeiten neuer Parteien wie Volt Europa. Diese seien im Stande, den etablierten nationalen Parteien die notwendige Entwicklung und den Weg hin zu einer gemeinsamen programmatischen Zusammenarbeit zu weisen.  Wir finden: stimmt! Dass Volt Europa bei der anstehenden Europawahl am 26. Mai in acht Ländern mit dem gleichen Programm antritt, zeigt, dass wir bereits viel weiter sind und diese Notwendigkeit längst erkannt haben!  Um dich weiter zu informieren, gelangst du hier zu unserem einheitlichen Europawahlprogramm: https://bit.ly/2D7VKZE  und hier zu unserem Grundsatzprogramm: https://bit.ly/2v2bXen.  Am 26. Mai ist Europawahl: Vote Volt.💜🇪🇺 #voteVolt #JointheChange #EuropeanElections #Europawahl #ep2019 #euelections2019 #EU #JetztBistDuDran","NA",4,23,115,105,9,1,0,0,0
265,https://www.facebook.com/Piratenpartei/posts/10157312389692783,Piratenpartei,2019-05-08T16:47:15Z,video,"Wer Klimaschutz will, muss in der #EU Industrie-Lobbyismus zurückdrängen meint Patrick Breyer, Spitzenkandidat der Piratenpartei Deutschland für das Europaparlament: #ClimateActionNow #Europawahl2019  https://www.youtube.com/watch?v=UYWsyyWa4gs",https://www.youtube.com/watch?v=UYWsyyWa4gs,1,13,30,29,1,0,0,0,0
266,https://www.facebook.com/VoltDeutschland/posts/414883955728996,VoltDeutschland,2019-05-08T14:17:00Z,photo,"Get to know us! Heute: Laura Caniglia  Gleichberechtigung von Frauen und Migration sind Themen, die Laura am Herzen liegen. Zu Migration sagt sie: “Die Spaltung der Gesellschaft  beim Thema Migration stellt den Konflikt zwischen Politik und Wirtschaft dar. Während die Politik mit Ideologien kämpft, brauchen viele Wirtschaftszweige Migranten. Eine kontrollierte Migration ist eine Bereicherung, auch für das aufnehmende Land.“ 💜🇪🇺 #GetToKnowUs #votevolt #EP2019",https://www.facebook.com/VoltDeutschland/photos/a.142697006281027/414883639062361/?type=3,4,17,174,163,11,0,0,0,0
267,https://www.facebook.com/CDU/posts/10156350594080415,CDU,2019-05-08T19:24:55Z,photo,"Wahlkampftour heute in Magdeburg bei der CDU Sachsen-Anhalt.  Wir brauchen ein #Europa, das nicht nur nach dem kleinsten gemeinsamen Nenner sucht, sondern eines, das sich gemeinsam um die großen Fragen kümmert!  #UnserEuropa macht stark.  Für Sicherheit, Frieden und Wohlstand.   #26MaiCDU Sven Schulze",https://www.facebook.com/CDU/photos/a.10152173007495415/10156350590475415/?type=3,137,15,281,212,3,3,44,0,19
268,https://www.facebook.com/FDP/posts/10157238629707250,FDP,2019-05-08T09:21:59Z,photo,"#SeiDabei: Im Live-Chat beantwortet Euch Alexander Graf Lambsdorff, ehem. Vize-Präsident des Europaparlaments, Eure Europa-Fragen zu den Themen #Wirtschaft, #Startups, #Freihandel und starker #Euro. Schreibt bereits jetzt Eure Fragen hier unter dieses Posting. #ChancenNutzen 🚀 #EP2019",https://www.facebook.com/FDP/photos/a.82276712249/10157238622752250/?type=3,9,10,66,60,5,0,1,0,0
269,https://www.facebook.com/tierschutzpartei/posts/2319690958053415,tierschutzpartei,2019-05-08T10:00:01Z,video,"Unser Bundesvorsitzender Matthias Ebner macht einen Faktencheck zu Kommunalwahl-Themen, denn am 26. Mai finden neben der Europawahl in 10 Bundesländern auch Kommunalwahlen statt. Hierzu konnten wir immerhin 12 Listen aufstellen - so viele wie noch nie. Bitte gebt unseren Listen eure Stimmen, wenn ihr für diese wahlberechtigt seid! Mehr dazu unter: tierschutzpartei.de/wahl Musik: Be Inspired- crescent Music/ Music promoted by Plow Music. https://www.youtube.com/watch?v=tQLN6xcrSWA",https://www.facebook.com/Tierschutzpartei/videos/413428249212696/,8,32,48,45,3,0,0,0,0
270,https://www.facebook.com/freie.waehler.bundesvereinigung/posts/1270387953113228,freie.waehler.bundesvereinigung,2019-05-08T19:06:25Z,link,Wir FREIE WÄHLER liefern! #Artenschutz,https://fw-landtag.de/index.php?id=18&tx_news_pi1%5Bnews%5D=9193&tx_news_pi1%5Bcontroller%5D=News&tx_news_pi1%5Baction%5D=detail&cHash=4ef35bf6f25a0b75bd1115fbb4a96636,2,1,15,14,0,1,0,0,0
271,https://www.facebook.com/CDU/posts/10156350007310415,CDU,2019-05-08T14:04:28Z,video,Eine Formel für die #Zukunft: Am 26. Mai die #CDU wählen! Wahlkampfauftritt von Annegret Kramp-Karrenbauer in Sankt Ingbert im #Saarland. Die #CDU kämpft vor Ort im #Kommunalwahlkampf und für #UnserEuropa. #26MaiCDU,https://www.facebook.com/CDU/videos/2265106637140128/,147,17,173,116,2,0,31,0,24
