id,URL,party,timestamp,type,message,link,comments_count,shares_count,reactions_count,like_count,love_count,wow_count,haha_count,sad_count,angry_count
1,https://www.facebook.com/oedp.de/posts/10157180226064568,oedp.de,2019-04-28T09:00:00Z,video,"Guido #Klamt aus #Ludwigsburg, Listenplatz 5 auf der Kandidatenliste der #ÖDP zur #Europawahl, stellt sich und seine Ziele in diesem Video vor:  Europawahl ohne Sperrklausel - ÖDP wählen! www.wenigeristmehr.jetzt",https://youtu.be/BF1-8LAd5Pg,0,4,9,9,0,0,0,0,0
2,https://www.facebook.com/tierschutzpartei/posts/2304648036224374,tierschutzpartei,2019-04-28T13:57:00Z,photo,"Aus unserem Europawahlprogramm, Kapitel 7: Gesundheits- und Sozialpolitik:  Bezahlbarer Wohnraum ist wesentliches Element sozialer Politik. Die EU hat jedoch bestimmte Förderungen von Sozialwohnungen als wettbewerbsverzerrend eingestuft, was in der praktischen Auswirkung nicht hinnehmbar ist. Dies wollen wir korrigieren und vielmehr noch mehr Mittel aus dem Struktur- und Investitionsfonds für den sozialen Wohnungsbau aufwenden lassen.  Das ganze Programm findet ihr hier: https://www.tierschutzpartei.de/europawahlprogramm-2019/",https://www.facebook.com/Tierschutzpartei/photos/a.125553314133868/2304643996224778/?type=3,17,130,395,354,23,3,11,2,2
3,https://www.facebook.com/B90DieGruenen/posts/10158265450753219,B90DieGruenen,2019-04-28T06:00:01Z,video,"Beim Wahlkampf-Camp in Berlin waren gestern hunderte Freiwillige, die sich im Tür-zu-Tür-Wahlkampf, beim Mobilisieren von Freiwilligen oder als Netzfeuerwehr geübt haben. Du willst auch im Tür-zu-Tür-Wahlkampf mitmachen? Dann hier entlang: gruene.de/von-tuer-zu-tuer Ab jetzt ist jeder Samstag Tür-zu-Tür-Tag! Teile das Video und hilf uns noch mehr Freiwillige für den Tür-zu-Tür-Wahlkampf zu gewinnen!",https://www.facebook.com/B90DieGruenen/videos/645708652526213/,70,28,215,174,14,3,16,0,8
4,https://www.facebook.com/FDP/posts/10157211498672250,FDP,2019-04-28T11:49:59Z,photo,Unser neuer Bundesvorstand 🎉🎊🎈 #ChancenNutzen 🚀#BPT19,https://www.facebook.com/FDP/photos/a.82276712249/10157211496907250/?type=3,16,9,262,254,7,0,1,0,0
5,https://www.facebook.com/tierschutzpartei/posts/2303134186375759,tierschutzpartei,2019-04-28T08:24:15Z,link,"Eine neue Studie der Universität Oxford zeigt, dass eine vegane Ernährung der wahrscheinlich größte Hebel ist, um den eigenen ökologischen Fußabdruck zu verringern. Es bringt laut Autor Joseph Poore viel mehr, als ein Elektroauto zu kaufen oder weniger zu fliegen.",https://www.spiegel.de/wissenschaft/mensch/veganer-sparen-jaehrlich-zwei-tonnen-treibhausgase-a-1264577.html,6,46,145,129,14,2,0,0,0
6,https://www.facebook.com/CDU/posts/10156326637335415,CDU,2019-04-28T09:12:19Z,video,"Freiheit ist nicht selbstverständlich. #UnserEuropa steht für freiheitliche Werte, Vertrauen und gute Partnerschaften. Mehr dazu in unserem Europawahlprogramm www.cdu.de/europaprogramm 🇪🇺",https://www.facebook.com/CDU/videos/1141358669387318/,239,136,398,292,8,0,58,2,38
7,https://www.facebook.com/SPD/posts/10156364721452749,SPD,2019-04-28T13:06:09Z,photo,"Katarina Barley sagt: Eine weitere Koalition mit der #EVP will ich nicht - wir sagen: gut so! Wir wollen ein soziales #Europa. Ein Europa, das zusammenhält. #EuropaistdieAntwort Mehr hier: https://link.spd.de/europaBams",https://www.facebook.com/katarina.barley/photos/a.1522204968077228/2067477803549939/?type=3,180,54,699,576,34,4,79,1,5
8,https://www.facebook.com/Piratenpartei/posts/10157287535052783,Piratenpartei,2019-04-28T17:36:30Z,video,Unser Spitzenkandidat Patrick Breyer mit einem Update zum EU19 Workshop in Koblenz:,https://www.facebook.com/PiratPatrickBreyer/videos/2294949184099736/,0,"NA",7,6,0,1,0,0,0
9,https://www.facebook.com/DiePARTEI/posts/2165809540121729,DiePARTEI,2019-04-28T07:44:28Z,link,Der absolut härteste „Martin-Sonneborn-Moment“ kommt für Watson.de nach der Machtübernahme... Smiley!,https://www.watson.de/deutschland/eu/692223151-die-partei-martin-sonneborn-hat-die-eu-jahre-lang-aufgemischt-7-beste-momente,35,76,612,509,49,0,54,0,0
10,https://www.facebook.com/CSU/posts/10157107029565688,CSU,2019-04-28T08:21:00Z,photo,"#Klartext von Bayerns Ministerpräsident und CSU-Chef Markus Söder in der ""Welt am Sonntag"":  Ohne schwarz zu malen: Die Wirtschaft wird langsam schwächer. Die internationalen Bedingungen leisten dem Vorschub und in Deutschland leiden wir unter der Auseinandersetzung um unsere wichtigste Leitindustrie, der Automobilität. Wir sollten daher nicht warten, bis wir Notmaßnahmen für die Konjunktur leisten müssen.",https://www.facebook.com/CSU/photos/a.311521140687/10157107059885688/?type=3,174,61,458,334,3,5,90,2,24
11,https://www.facebook.com/DiePARTEI/posts/2165847896784560,DiePARTEI,2019-04-28T08:11:28Z,video,Anstelle des dämlichen NPD-Wahlwerbespots könnte doch das ZDF für seine Zuschauer (128 plus) diesen Spot von Nico Semsrott ausstrahlen... ZwinkerSmiley!,https://www.facebook.com/nicosemsrott/videos/2275269842496498/,61,312,1601,1344,77,1,179,0,0
12,https://www.facebook.com/alternativefuerde/posts/2385027378194254,alternativefuerde,2019-04-28T14:55:00Z,link,"++ Halal-Messe: Jetzt wird Deutschland fit fürs Schächten! ++  Nach dem Aus der weltgrößten und bedeutendsten IT-Messe Cebit hat man in Hannover offenbar schnell Ersatz gefunden. Ab nächstem Jahr erhält Deutschland seine erste Halal-Messe, die dann vom 6. bis 8. März stattfinden wird.   Wir sind aufs Äußerste gespannt, welche Produkte die nationalen und internationalen Aussteller präsentieren werden. Schon die Eröffnung verspricht interessant zu werden. Kommt der Muezzin, damit alle richtungssicher gen Mekka auf die Knie fallen können, um Allah anzurufen? Wird es ein buntes Rahmenprogramm geben, das interessierten Besuchern das Schächten am deutschen Huhn und der deutschen Kuh näherbringt? Vielleicht stellen in einem Teilbereich auch befreundete Muslime ihre neuesten Kopftuch- und Niquab-Kollektionen vor.   Besucherandrang erhofft sich die Deutsche Messe AG vor allem aus dem Groß- und Einzelhandel, Supermärkten, von Gastronomen, Imbissen, Caterern, Lebensmittelchemikern, Qualitätsmanagern sowie Verbrauchern. Sie alle sollen fröhlich auf die neuen Gepflogenheiten der noch nicht so lange hier Lebenden eingeschworen werden. Parallel findet ein internationaler Kongress statt, wo wohlfeil politische, wirtschaftliche und gesellschaftliche Halal-Themen diskutiert werden. Es sind Vorträge zu Themen wie Zertifizierung, Produktion und Marketing von Halal-Lebensmitteln, Halal-Tourismus und Logistik geplant.  Ganz schon halal! Der Trend ist klar. Schon heute wandert geschächtetes Fleisch der Branchenführer Wiesenhof und Tönnies bereits auf die Teller der Verbraucher. In den Betriebsanlagen sind muslimische Mitarbeiter im Einsatz, die Richtung Mekka unter Allah-Anrufungen die Tiere lebendig ausbluten lassen. Guten Appetit. Nein, eine Islamisierung findet gewiss nicht statt...  https://www.facebook.com/alternativefuerde/photos/-irrenhaus-deutschland-immer-mehr-halal-fleisch-auf-unseren-tellern-eine-islamis/1969490829747913/  https://halal-welt.com/neue-halal-messe-startet-2020-in-hannover/?fbclid=IwAR0Ui7A0m2NXpsRjYnNcjXzt1bltcrzeXPXBQSQn3D4OyvnImulwa9Z9eKk",https://halal-welt.com/neue-halal-messe-startet-2020-in-hannover/?fbclid=IwAR0Ui7A0m2NXpsRjYnNcjXzt1bltcrzeXPXBQSQn3D4OyvnImulwa9Z9eKklebendig,1163,1499,3944,540,4,56,239,96,3009
13,https://www.facebook.com/FDP/posts/10157210896877250,FDP,2019-04-28T06:18:18Z,photo,"Wir wollen nicht den Staat groß machen. Wir wollen alle stark machen. Denn ein Land wächst mit seinen Menschen und deshalb investieren wir in genau diese Menschen, damit sie unser Land stark und erfolgreich machen können, so Christian Lindner.   #MondaysForEconomy #FridaysForFuture #SaturdaysForDebate #SundaysForEurope #BPT19 #Wirtschaftsdiskurs19",https://www.facebook.com/FDP/photos/a.82276712249/10157210883767250/?type=3,47,110,622,589,24,0,7,0,2
14,https://www.facebook.com/FDP/posts/10157211563012250,FDP,2019-04-28T14:03:00Z,video,"Du hast die Rede von Nicola Beer auf dem #BPT19 verpasst❓ Hier kannst Du Dir das Best-of anschauen!  💪  ""Europa 🇪🇺 muss seine #ChancenNutzen, indem es sich reformiert. Denn ich bin überzeugt: Europa kann es besser!"", so Beer.  #RenewEurope #TeamEurope",https://www.facebook.com/FDP/videos/353079842220887/,358,89,463,258,7,3,85,3,107
15,https://www.facebook.com/FDP/posts/10157211381377250,FDP,2019-04-28T10:40:57Z,photo,"Weil wir Freien Demokraten mit Herzblut an Europa glauben, wollen wir die Europäische Union 🇪🇺 reformieren und damit dessen ungenutzten Potentiale entfesseln. Wir wollen Europas Chancen nutzen! Die Europäer sollen wieder unmittelbar in ihrem Alltag erfahren und verstehen können, warum unser gemeinsames Haus Europa unsere Zukunft ist.  #BPT19 #ChancenNutzen 🚀 #RenewEurope #TeamEurope",https://www.facebook.com/FDP/photos/a.82276712249/10157211377182250/?type=3,14,19,226,210,12,0,4,0,0
16,https://www.facebook.com/DiePARTEI/posts/2166091676760182,DiePARTEI,2019-04-28T12:18:32Z,video,EUSmiley,https://www.facebook.com/DiePARTEIHH/videos/434394227123594/,15,15,222,185,13,0,24,0,0
17,https://www.facebook.com/CSU/posts/10157107063595688,CSU,2019-04-28T12:35:00Z,photo,Wir brauchen endlich einen massiven Ausbau der  künstlichen Intelligenz. Bisherige Investitionen sind im internationalen Vergleich zu gering. Die Welt läuft uns davon. Wir brauchen intensive Forschung im Bereich Batteriezelle und einen Quantensprung bei Supercomputing und autonomem Fahren.,https://www.facebook.com/CSU/photos/a.311521140687/10157107061115688/?type=3,133,20,330,228,2,2,70,0,28
18,https://www.facebook.com/CDU/posts/1264984546992763,CDU,2019-04-29T11:38:01Z,video,Live: Paul Ziemiak berichtet im Konrad-Adenauer-Haus aus den Sitzungen der #CDU-Gremien.,https://www.facebook.com/CDU/videos/1264984546992763/,140,17,190,131,4,2,27,1,25
19,https://www.facebook.com/DiePARTEI/posts/2167740146595335,DiePARTEI,2019-04-29T14:46:39Z,photo,Hat jemand einen feinen Slogan für uns? So was wie #EuropaIstDieAntwort? Smiley!,https://www.facebook.com/nicosemsrott/photos/a.10151232179512836/10157116391597836/?type=3,215,28,522,462,33,0,27,0,0
20,https://www.facebook.com/oedp.de/posts/10157182211079568,oedp.de,2019-04-29T05:07:00Z,photo,"#Klimaschutz und #Artenschutz bedeuten auch, dass wir unsere Ernährungsgewohnheiten hinterfragen sollten, denn ca. 70 Prozent der direkten #Treibhausgasemissionen unserer #Ernährung sind auf tierische Produkte zurückzuführen. Die #ÖDP sieht eine ausgewogene Ernährung mit geringem #Fleischkonsum als erstrebenswert an. Für zahlreiche unserer Parteimitglieder ist es bereits selbstverständlich, auf #Fleisch zu verzichten oder den Konsum stark einzuschränken und artgerecht produziertes Fleisch zu kaufen. ÖDP-Parteitage bieten den Delegierten seit längerem nur mehr #vegetarische und #vegane Kost an.  Kurz gesagt: weniger Fleisch ist mehr Klimaschutz! www.wenigeristmehr.jetzt  #Europawahl: ÖDP wieder ins #Europaparlament wählen.",https://www.facebook.com/oedp.de/photos/a.393610334567/10157182211079568/?type=3,21,70,238,216,8,1,10,0,3
21,https://www.facebook.com/SPD/posts/10156367176982749,SPD,2019-04-29T14:17:39Z,photo,"NA",https://www.facebook.com/klingbeil.lars/photos/a.10151296960191094/10156387039521094/?type=3,296,57,516,411,10,4,87,0,4
22,https://www.facebook.com/alternativefuerde/posts/2389821077714884,alternativefuerde,2019-04-29T15:55:00Z,photo,"++ Brüssel raubt Deutschlands Veto-Recht: Das große Ausplündern steht kurz bevor! ++  Heimlich, still und leise plant die EU ihren nächsten Coup zum Schaden Deutschlands! Müssen wir bald die Kassen der Sozialsysteme anderer Mitgliedsstaaten füllen?  Konkret geht es darum, Mehrheitsentscheidungen bei der Sozial- und Steuerpolitik einzuführen. Bisher musste hier mit Einstimmigkeit beschlossen werden - ein letzter Rettungsanker für unser Land, um sich mit einem Veto vor den Folgen einer unkontrollierten Beutementalität zu schützen. Deutschland als größte Volkswirtschaft innerhalb der europäischen Union ist die Zitrone schlechthin, die viele allzu gern auspressen möchten.   Nun will man seitens Brüssel unbemerkt von der Öffentlichkeit mit dem Wechsel von der Einstimmigkeit hin zum Mehrheitsbeschluss unser Land mundtot machen. Gerade die finanziell sensiblen Themen wie Sozial- und Steuerpolitik haben das Potenzial, große Umverteilungsmechanismen in Gang zu setzen - zu Lasten Deutschlands und seiner Steuerzahler! Müssen wir bald die Sozialkassen anderer Länder füllen? Die Gefahr war nie größer als heute.  Mit dem Brexit wurde die Achse der Nordländer innerhalb der EU, also die der Geberländer empfindlich geschwächt. Wir verfügen nicht länger über die nötigen Stimmanteile, um europäische Vorhaben notfalls zu blockieren. Gleichzeitig wächst das Gewicht der Mittelmeerstaaten, die allesamt klassische Nettoempfänger sind. Wie sich das auswächst, können wir aller Wahrscheinlichkeit nach bald selbst herausfinden.  Die EU ist das Gegenteil von Demokratie. Wenn Juncker ganz harmlos von ""Mehrheitsentscheidungen"" spricht, plant er nichts anderes, als den Bürgern wiederholt Sand in die Augen zu streuen. Diese wissen derweil nicht mehr, wie ihnen geschieht. Bitte gehen Sie am 26. Mai wählen. Unterstützen Sie die AfD und damit die konservativ-patriotischen Kräfte im Brüsseler Parlament mit Ihrer Stimme! Wir dürfen uns Brüssels Diktat nicht länger gefallen lassen!   https://www.welt.de/debatte/kommentare/article192580069/Kommissions-Plan-Ein-EU-Vorhaben-das-vor-allem-Deutschland-schadet.html  Hier finden Sie alle Infos zur Europawahl und unseren Kandidaten: ➡ https://www.afd.de/europawahl/  Jetzt Plakat spenden und bis 3. Mai Wunschort auswählen: ➡️ https://www.afd.de/plakat-spenden/",https://www.facebook.com/alternativefuerde/photos/a.542889462408064/2390216247675367/?type=3,760,4448,4267,1475,4,51,32,140,2565
23,https://www.facebook.com/DiePARTEI/posts/2167587569943926,DiePARTEI,2019-04-29T12:49:44Z,photo,"NA",https://www.facebook.com/MartinSonnebornEU/photos/a.665725823489212/2294198497308595/?type=3,12,18,509,417,19,1,72,0,0
24,https://www.facebook.com/Piratenpartei/posts/10157288752922783,Piratenpartei,2019-04-29T04:06:18Z,photo,"NA",https://www.facebook.com/PiratenHessen/photos/a.459570124061730/2369897793028944/?type=3,0,2,13,13,0,0,0,0,0
25,https://www.facebook.com/tierschutzpartei/posts/2301822149840296,tierschutzpartei,2019-04-29T10:04:00Z,link,"Bitte helft uns dabei, in Zukunft einfacher die nötigen Unterstützungsunterschriften zu bekommen. Bei Landtagswahlen müssen wir z. B. oft 2000 Unterschriften sammeln, nur um überhaupt antreten zu können. Das ist immer ein riesiger Kraftakt und bindet viele Ressourcen, die wir dann nicht mehr in unsere eigentliche Arbeit stecken können. Wenn ihr in Zukunft bereit wärt, eine Unterschrift für uns zu leisten, dann tragt euch bitte auf unserer Webseite ein, damit wir, wenn wieder eine Wahl ansteht, euch die nötigen Formulare inkl. Rückumschlag schicken können. Ihr zahlt keine Portokosten und es kostet euch nur 5 Minuten. Unsere Aktiven müssten dann aber vielleicht nicht mehr vor jeder Wahl wieder und wieder so viele Stunden und Tage auf der Straße unterwegs sein und Unterschriften sammeln. Wir sind euch auch sehr dankbar, wenn ihr diesen Post weiterverbreitet und wenn ihr Freunde und Bekannte darum bittet, sich auch einzutragen! http://www.tierschutzpartei.de/unterschreiben",http://www.tierschutzpartei.de/unterschreiben,37,115,172,169,3,0,0,0,0
26,https://www.facebook.com/SPD/posts/288553312072786,SPD,2019-04-29T09:02:51Z,video,"Pressekonferenz mit Lars Klingbeil, Katarina Barley und Udo Bullmann",https://www.facebook.com/SPD/videos/288553312072786/,174,67,312,239,30,1,23,2,17
27,https://www.facebook.com/DiePARTEI/posts/2167470999955583,DiePARTEI,2019-04-29T11:02:20Z,photo,Unserer Kandidierenden für das Europäische Parlament stellen sich vor. Heute: Listenplatz 139,https://www.facebook.com/Die.PARTEI.MG/photos/a.1714375072205137/1983375258638449/?type=3,15,8,244,199,14,0,31,0,0
28,https://www.facebook.com/CSU/posts/10157112524220688,CSU,2019-04-29T14:39:36Z,photo,100 Tage CSU-Parteivorsitzender Markus Söder,https://www.facebook.com/markus.soder.75/photos/a.708011275939219/2644256725647988/?type=3,56,12,223,125,2,1,71,0,24
29,https://www.facebook.com/CSU/posts/10157113028590688,CSU,2019-04-29T19:28:13Z,photo,"Anlässlich des 80. Geburtstags des CSU-Ehrenvorsitzenden Theo Waigel hat der CSU-Vorsitzende und Bayerische Ministerpräsident Markus Söder zu einem feierlichen Europa-Symposium eingeladen. Ehrengäste waren der ehemalige Bundespräsident Horst Köhler, der Spitzenkandidat zur Europawahl Manfred Weber und Klaus Regling, Geschäftsführender Direktor des European Stability Mechanism.",https://www.facebook.com/CSU/photos/a.311521140687/10157113024605688/?type=3,21,5,233,211,1,0,8,0,13
30,https://www.facebook.com/alternativefuerde/posts/2388940047802987,alternativefuerde,2019-04-29T07:00:30Z,photo,"++ Widerliche Tat in Oldenburg/Damm: 80-Jährige sexuell missbraucht ++  Welche Panik muss die 80-jährige Seniorin ergriffen haben, als sie plötzlich kurz vor 22 Uhr in ihrer Wohnung Geräusche und Licht wahrnahm? Doch das Martyrium stand ihr erst bevor.  Natürlich sah die Frau nach, entfernte sich aus ihrer Küche in den Flur. Bisher glaubte sie sich in ihrer Oldenburger Hochparterre-Wohnung sicher. Sie erschrak, als sie plötzlich auf einen Mann traf. Durch ein gewaltsam geöffnetes Fenster hatte er sich Zutritt verschafft. Er muss die 80-Jährige ausgekundschaftet haben. Ein leichtes Opfer vermutete er in ihr, sie wollte er ausrauben.  Ob und was genau gestohlen wurde, ist den laufenden Ermittlungen noch nicht zu entnehmen. Fest steht allerdings, dass der Mann die Seniorin brutal vergewaltigte, als sie ihm im Flur begegnete. In Todesangst ließ die Frau alles über sich ergehen. Während des Übergriffs wurde sie verletzt. Trotz des Schocks darüber, was ihr angetan wurde, erstattete sie umgehend Anzeige bei der Polizei. Ihre Täterbeschreibung klingt wohlvertraut: Es soll sich um einen etwa 20 Jahre alten und etwa 1,75 Meter großen Mann mit ""südländischem Erscheinungsbild"" gehandelt haben, schwarzes Haar, dunkle Augen - Sie wissen schon.  Es ist der helle Wahnsinn, wie inzwischen auch verstärkt unsere Seniorinnen und Senioren die Auswüchse von Merkels Multikulti-Deutschland erleiden müssen. Sie werden bespuckt, ihre Gehhilfen werden weggetreten. Sie werden beraubt, vergewaltigt und immer wieder kommen sie dabei ums Leben. Wie würdelos, im hochbetagten Alter auch noch das mitmachen zu müssen! Die Angst geht um, denn wir alle haben betagte Mütter, Väter, Großeltern und liebe, ältere Freunde, die wir in Gefahr wissen. Wann handelt endlich die Politik? Oder sind diejenigen, die uns aufgezogen haben, unserem Land Wohlstand durch ihre Schaffenskraft und ihren Fleiß schenkten, nur verzichtbare Opfer, die der Politik egal sind?  https://www.nwzonline.de/oldenburg/blaulicht/oldenburg-kriminalitaet-in-oldenburg-80-jaehrige-sexuell_a_50,4,2441315567.html",https://www.facebook.com/alternativefuerde/photos/a.542889462408064/2389655951064730/?type=3,1480,5370,6114,951,0,40,4,496,4623
31,https://www.facebook.com/CDU/posts/10156328860375415,CDU,2019-04-29T09:58:45Z,video,Da stimmt das Gesamtpaket. Deswegen ist es ganz einfach: Am 26. Mai #CDU und #CSU wählen! 🇪🇺 #unserEuropa #26MaiCDU   Mehr vom gemeinsamen Wahlkampfauftakt der Union im Video.,https://www.facebook.com/CDU/videos/2094857400810559/,274,76,448,302,14,0,112,1,19
32,https://www.facebook.com/FDP/posts/10157214598217250,FDP,2019-04-29T13:24:08Z,video,"Warum wir uns für #Bildung auch auf EU-Ebene 🇪🇺 einsetzen und was wir ändern wollen, erklärt Euch Nicola Beer im Video 📺 zur Themenwoche.💪  #ChancenNutzen 🚀",https://www.facebook.com/FDP/videos/578415875984410/,342,65,481,382,21,2,66,1,9
33,https://www.facebook.com/DiePARTEI/posts/2167737739928909,DiePARTEI,2019-04-29T14:44:48Z,video,Lisas Reise geht weiter.,https://www.facebook.com/DiePARTEIHH/videos/2173827719377638/,5,8,122,117,5,0,0,0,0
34,https://www.facebook.com/freie.waehler.bundesvereinigung/posts/1263958713756152,freie.waehler.bundesvereinigung,2019-04-29T18:00:01Z,photo,"Heimat der Sicherheit Europa muss sicherer werden, um wieder ohne Grenzkontrollen auszukommen: organisierte Kriminalität, Terrorgefahr und unkontrollierte Migration stellen aber unseren Wunsch nach einem Europa ohne Binnengrenzen derzeit in Frage. Grenzkontrollen oder sogar Grenzzäune sind in einigen Ländern Europas wieder Realität geworden. Das wollen wir FREIE WÄHLER ändern, indem wir die europäische Sicherheit nach innen und außen massiv stärken.   Alle unsere Vorhaben finden Sie hier: https://www.unsereheimateuropa.de/unsere-politik/sicherheit/   #UnsereHeimatEuropa #FREIEWÄHLER",https://www.facebook.com/freie.waehler.bundesvereinigung/photos/a.204390103046357/1263958377089519/?type=3,83,80,302,182,1,6,91,0,22
35,https://www.facebook.com/FDP/posts/10157214825702250,FDP,2019-04-29T15:24:00Z,photo,"Es ist nicht wichtig, woher Du kommst, sondern wohin Du willst❗️Damit Du das kannst, wollen wir die Stipendienkultur auf europäischer Ebene ausbauen. 💪 Zum Beispiel durch die Vergabe von #Forschungsstipendien aus Mitteln der EU 🇪🇺. Dazu gehört auch ein Programm für ein #Europastipendium – ähnlich dem Deutschlandstipendium –, das an Studierende vergeben wird, die nach ihrem Schulabschluss zum Studium in ein anderes Land wechseln wollen. #ChancenNutzen 🚀",https://www.facebook.com/FDP/photos/a.82276712249/10157214780672250/?type=3,24,18,236,221,12,0,3,0,0
36,https://www.facebook.com/B90DieGruenen/posts/10158269874078219,B90DieGruenen,2019-04-29T10:00:01Z,video,"Tadaaa! Unser Spot zur #Europawahl. Teile unseren Wahlspot mit so vielen Freund*innen wie möglich 💚  Für ein ökologisches, demokratisches und soziales Europa 🌻🇪🇺",https://www.facebook.com/B90DieGruenen/videos/668289276936094/,286,1511,1897,1603,161,6,90,1,36
37,https://www.facebook.com/freie.waehler.bundesvereinigung/posts/1264002600418430,freie.waehler.bundesvereinigung,2019-04-29T14:01:20Z,photo,"NA",https://www.facebook.com/fwbayern/photos/a.276512345835515/1280650335421706/?type=3,7,8,84,82,1,0,0,1,0
38,https://www.facebook.com/B90DieGruenen/posts/10158270559033219,B90DieGruenen,2019-04-29T15:50:16Z,photo,"Stell deine Fragen an unser Spitzenduo! Ska Keller und Sven Giegold sind ab heute auf deutschlandweiter Kommt-wir-bauen-das-neue-Europa-Tour. Townhalls, Stände, Aktionen – zahlreiche Gelegenheiten, um Ska und Sven persönlich zu treffen. Auch in deiner Nähe: gruene.de/wahlkampftour Teile unser Bild und verabrede dich mit deinen Freund*innen zu einem Townhall-Event in eurer Nähe!",https://www.facebook.com/B90DieGruenen/photos/a.103764373218/10158270471903219/?type=3,73,81,356,314,17,2,16,3,4
39,https://www.facebook.com/VoltDeutschland/posts/410660379484687,VoltDeutschland,2019-04-29T07:40:24Z,photo,"Volt - Wie alles begann:  2016 veranlasste das Votum zum Brexit und der immer weiter wachsende Einfluss von Rechtspopulisten in Europa die Europäer Andrea Venzon,Damian Boeselager und Colombe Cahen-Salvador dazu, mit Volt einen grenzübergreifenden und deshalb paneuropäischen politischen Ansatz für Europa zu finden mit dem Ziel, neue pragmatische und progressive Antworten auf die Herausforderungen der heutigen Zeit zu finden.  Unsere Vision ist ein vereinigtes Europa mit echter europäischer Demokratie - dazu bedarf es eines starken Europa Parlaments, das Gesetze vorschlagen kann und eine europäische Ministerpräsident*in wählt, die sich vor unseren Volksvertretern verantworten muss. Wir wollen eine echte europäische Regierung, die die Interessen aller Europäerinnen und Europäer vertritt! Europäische Politik braucht dazu europäische Parteien.🇪🇺 #votevolt #jointhechange #EP2019 #Europawahl",https://www.facebook.com/VoltDeutschland/photos/a.142697006281027/410660249484700/?type=3,9,89,284,265,13,3,2,0,1
40,https://www.facebook.com/linkspartei/posts/10155835382165683,linkspartei,2019-04-29T13:44:29Z,video,"Reguläre Jobs mit ordentlichen Löhnen und fairen Arbeitsbedingungen sind machbar. Hier unser 5-Punkte-Plan, mit dem gute Arbeit gegen die Macht der Konzerne durchgesetzt werden kann.",https://www.facebook.com/linkspartei/videos/2309694772603512/,29,363,578,537,30,2,7,0,2
41,https://www.facebook.com/freie.waehler.bundesvereinigung/posts/1263958080422882,freie.waehler.bundesvereinigung,2019-04-29T16:00:00Z,link,"Westbalkan Konferenz in Berlin – Zeitnaher EU-Beitritt nicht denkbar  Heute trafen sich auf Einladung von Frankreich und Deutschland die 8 Westbalkanländer in Berlin. Im Mittelpunkt standen dabei die seit 20 Jahren schwelenden Konflikte zwischen Serbien und dem Kosovo.   Diese Territorialstreitigkeiten sowie die internen Konflikte in Bosnien-Herzegowina stellen die größte Hürde für einen baldigen EU Beitritt dieser Länder dar. Für uns FREIE WÄHLER ist jedoch klar, dass Niemandem, der Teil unserer Werteordnung ist, eine Teilhabe an unserem europäischen Friedenswerk von vornherein verwehrt werden sollte. Schon bei den mittelosteuropäischen Ländern haben sich in Folge der Auflösung des Ostblocks ehrliche Beitrittsperspektiven als Reformmotor bewährt.  Die Verhandlungen mit den Staaten des Westbalkans wollen wir FREIE WÄHLER deshalb fortführen. Angesichts des bisherigen Verhandlungsverlaufes und der noch laufenden Konsolidierung der Union halten wir eine zeitnahe Aufnahme aller oder einzelner Westbalkanstaaten jedoch für noch nicht durchführbar.  #UnsereHeimatEuropa #FREIEWÄHLER","https://www.swr.de/swraktuell/Balkankonferenz-in-Berlin-Schwierige-Annaehrung-zwischen-Serbien-und-Kosovo,balkan-konferenz-100.html",16,6,28,10,0,0,0,2,16
