id,URL,party,timestamp,type,message,link,comments_count,shares_count,reactions_count,like_count,love_count,wow_count,haha_count,sad_count,angry_count
609,https://www.facebook.com/CSU/posts/10157162915700688,CSU,2019-05-20T09:31:45Z,photo,Unser Europa braucht eine starke bayerische Stimme! Mit Manfred Weber kann erstmals ein Bayer an Europas Spitze stehen. Das ist eine historische Chance! Deshalb am 26. Mai CSU wählen!,https://www.facebook.com/CSU/photos/a.311521140687/10157162916005688/?type=3,255,104,914,526,5,9,258,7,109
610,https://www.facebook.com/linkspartei/posts/10155878370615683,linkspartei,2019-05-20T14:13:56Z,video,"Wir haben nun einen Einblick bekommen, wie verkommen die FPÖ in Österreich ist. Niemand sollte sich etwas vormachen: Die AfD ist die Schwesterpartei der FPÖ. Kleine und große Straches gibt es auch in der AfD. Jörg Meuthen und Alice Weidel haben dubiose Spenden von Milliardären entgegen genommen, das riecht nach Käuflichkeit der AfD.",https://www.facebook.com/linkspartei/videos/375842046361077/,319,201,944,734,23,8,104,3,72
611,https://www.facebook.com/DiePARTEI/posts/2201608676541815,DiePARTEI,2019-05-20T14:45:02Z,video,"Die PARTEI präsentiert: Meine neueste Peinlich-Politische PowerPointPräsentation (PPPPP), in der ich eine wichtige Frage beantworte: Wer ist eigentlich dieser EU?",https://www.facebook.com/DiePARTEI/videos/402257853955020/,66,350,1509,1337,79,2,90,1,0
612,https://www.facebook.com/CDU/posts/10156377719155415,CDU,2019-05-20T14:32:36Z,video,"Vergangene Woche war Annegret Kramp-Karrenbauer in Niedersachsen für #unserEuropa unterwegs.  Bei der Europawahl 🗳 geht es um die konkrete Frage, ob wir die Spielregeln in der Welt auf Grundlage unserer Werte, Demokratie, Rechtsstaatlichkeit, Menschenrechte und Meinungsfreiheit auch in Zukunft mitgestalten wollen. Gemeinsam mit Manfred Weber kämpfe ich für ein starkes Europa, das Sicherheit, Frieden und Wohlstand schafft.   👉 Die Formel für die Zukunft lautet: #26MaiCDU",https://www.facebook.com/CDU/videos/2322868807970082/,198,24,194,118,6,0,38,0,32
613,https://www.facebook.com/VoltDeutschland/posts/421539875063404,VoltDeutschland,2019-05-20T15:27:42Z,photo,"Es ist an der Zeit, dass wir umdenken und von Anfang an europäisch handeln.  Denn: Es reicht heute für Parteien nicht mehr aus, lediglich proeuropäisch zu sein, wenn sie es nicht schaffen, diese Ziele europaweit zu bündeln.   Volt hingegen ist konsequent europäisch.  Ihr findet uns im jeden EU-Land und darüber hinaus. Grenzübergreifend haben wir ein Grundsatzprogramm geschrieben und verfolgen diese Ziele gemeinsam.  In 8 Ländern treten wir zur Europawahl an. 💜🇪🇺 #votevolt #jointhechange #jetztbistdudran",https://www.facebook.com/VoltDeutschland/photos/a.142697006281027/421539751730083/?type=3,9,43,222,210,11,0,1,0,0
614,https://www.facebook.com/VoltDeutschland/posts/421419845075407,VoltDeutschland,2019-05-20T07:53:22Z,photo,"Geht to know us! Heute: Caroline Flohr Caroline liegen Themen wie politische Integration und Migration besonders am Herzen. “Für mich ist weitere politische integration auf europäischer Ebene die logische Schlussfolgerung, um unsere Probleme gemeinsam zu lösen. In einer stärkeren parlmentarischen Demokratie würde jede Stimme in Europa gehört werden. Wir müssen enger zusammen rücken und unsere nationalen Interessen zurücksetzen. Wir müssen gemeinsam ein europäisches Asylsystem entwickeln, denn es kann nicht sein, dass einzelne Länder und Menschen im Stich gelassen werden!“ 🇪🇺💜  #GetToKnowUs #votevolt #EP2019",https://www.facebook.com/VoltDeutschland/photos/a.148220289062032/421419775075414/?type=3,2,12,114,108,5,1,0,0,0
615,https://www.facebook.com/linkspartei/posts/10155878619365683,linkspartei,2019-05-20T17:25:29Z,video,Die Herausforderungen in Ostdeutschland sind gesamtdeutsche. Sie sind Herausforderungen der sozialen Gerechtigkeit. Wir legten heute unseren Zukunftsplan Ost vor: https://www.die-linke.de/start/nachrichten/detail/der-linke-plan-fuer-eine-lebenswerte-zukunft-in-ostdeutschland/,https://www.facebook.com/linkspartei/videos/423082201820909/,37,78,250,225,8,0,15,1,1
616,https://www.facebook.com/alternativefuerde/posts/2425401800823478,alternativefuerde,2019-05-20T09:49:00Z,photo,"++ Merkel hat gelogen: Geheime Besprechungen beim UN-Migrationspakt sind Fakt ++  Nun kriecht die gekaufte Katze langsam aus ihrem Sack: Der umstrittene UN-Migrationspakt wurde in Teilen geheim und hinter verschlossenen Türen verhandelt.   Erst nach einem vom Tagesspiegel geführten Widerspruchsverfahren musste das Auswärtige Amt bestätigen, dass der Migrationspakt jenseits aller demokratischen Diskussionskultur zustande kam. Das schwante den meisten Beobachtern ohnehin, denn das Vertragswerk fand erst in den letzten Wochen ans Tageslicht - maßgeblich getrieben von der AfD, die auf breiter Front über diese Büchse der Pandora informierte.  Laut der nur widerwillig geäußerten Information des Auswärtigen Amtes seien die zwischenstaatlichen Verhandlungsrunden in New York nur „teilweise öffentlich“ gewesen. Es habe außerdem „vor- und nachgeschaltete nicht-öffentliche Sitzungen“ gegeben. Tatsächlich wurde die Regierung Merkel nicht müde, immer wieder die Transparenz des gesamten Verfahrens zu betonen. Man war sich nicht zu schade, den Bürgern nach allen Regeln der Kunst Sand in die Augen zu streuen. Was für eine Schande!  ~~~~~~~~~~~~~~~~~~~~~~~~~~~~~~~~~~~~~~~~~~  Warum geht die AfD gegen den UN-Migrationspakt auf die Barrikaden?  Der Pakt wurde ohne demokratische Legitimation initiiert. Er schafft illegale Migration durch Gleichstellung mit legaler Migration ab und erzeugt einen noch größeren Wanderungsdruck. Er benennt praktisch nur die Rechte der „Migranten“ und die Pflichten der Zielländer. Dahinter verbirgt sich ein verstecktes Umsiedlungsprogramm für Wirtschafts- und Armutsflüchtlinge, da Qualifikationen ohne formalen Nachweis anerkannt werden.  Der UN-Migrationspakt ermöglicht allen künftigen Migranten den Zugang zum Sozialsystem, zu dessen Erbringung sie nichts beigetragen haben. Er statuiert eine Aufnahmepflicht für alle, die behaupten, Opfer des „Klimawandels“ zu sein. Er bürdet sämtliche mit der Zuwanderung einhergehenden Kosten den Zielländern auf. Gleichzeitig blendet der Pakt die möglichen Gefahren für die innere Sicherheit durch Zuwandererkriminalität aus und ignoriert die Probleme bei der Integration von Menschen aus anderen Kulturkreisen. Außerdem fordert er auf, in den Medien über die Vorteile der Zuwanderung im Sinne einer „Bereicherung der Gesellschaft“ zu „sensibilisieren“ und „falsche“ Berichterstattung zu bestrafen. Künftig sollen Täterprofil-Erstellungen aufgrund der Ethnie oder Religion verboten werden.  https://www.afd.de/migrationspakt-stoppen/  https://www.tagesspiegel.de/politik/geheime-besprechungen-beim-un-migrationspakt-auswaertiges-amt-raeumt-nichtoeffentliche-sitzungen-ein/24354780.html",https://www.facebook.com/alternativefuerde/photos/a.542889462408064/2425401574156834/?type=3,3100,11719,10163,3857,19,250,146,123,5768
617,https://www.facebook.com/SPD/posts/10156416122297749,SPD,2019-05-20T16:39:20Z,photo,"Heute Abend, 21.00: Das Erste einschalten! Andrea Nahles beim 'Gipfeltreffen Europa - die Parteichefs im Gespräch'. Mitdiskutieren unter #EuropaistdieAntwort. 😀",https://www.facebook.com/SPD/photos/a.73469452748/10156416119657749/?type=3,172,20,252,160,4,3,65,1,19
618,https://www.facebook.com/CSU/posts/10157163250980688,CSU,2019-05-20T12:38:38Z,photo,Eine bayerische Initiative zur steuerlichen Entlastung von billigem Wohnraum ist am Freitag an den Stimmen der SPD-geführten Länder im Bundesrat gescheitert. Mehr dazu in den Kommentaren⬇️,https://www.facebook.com/CSU/photos/a.311521140687/10157163303250688/?type=3,70,121,291,120,1,14,52,13,91
619,https://www.facebook.com/VoltDeutschland/posts/421608588389866,VoltDeutschland,2019-05-20T15:59:46Z,photo,"Unsere Stellungnahme zum Verfahren zur Abänderung des Wahl-O-Mats  Volt hat letzte Woche beim Verwaltungsgericht Köln eine einstweilige Verfügung zur Abänderung des Wahl-O-Maten beantragt. In der Praxis des Wahl-O-Maten, nur 8 anstelle der  41 zur Europawahl antretenden Parteien im Ergebnis anzuzeigen, sahen wir einen Verstoß gegen die verfassungsmäßig festgeschriebene allgemeine Chancengleichheit der Parteien im politischen Wettbewerb.  Heute Nachmittag hat das Verwaltungsgericht  bekannt gegeben, dass es unserer Argumentation gefolgt ist (Az.: 6 L 1056/19) und zugunsten von Volt entschieden hat. Die Bundeszentrale für politische Bildung hatte argumentiert, dass eine Anzeige aller 41 Parteien technisch nicht möglich sei. Das Gericht hielt diese Begründung für nicht haltbar.  Da Volt das Verfahren gewonnen hat, steht die Bundeszentrale für politische Bildung jetzt vor der Wahl: Entweder sie ändert ihren Dienst oder sie schaltet ihn ab. Natürlich hoffen wir, dass die Bundeszentrale für politische Bildung sich für eine Änderung ihres Dienstes entscheidet, da auch wir das Angebot des Wahl-O-Maten, über 38 Fragen Informationen über Parteien zu erhalten, befürworten und als wichtigen Baustein der politischen Willensbildung betrachten. Die Anzeigepraxis darf dabei jedoch nicht zur Bevorteilung etablierter Parteien führen. Das Gericht legte den Betreibern des Wahl-O-Maten in der Urteilsbegründung auch nahe, ihren Dienst zu ändern und nicht abzuschalten, da eine Abänderung technisch sehr wohl möglich sein müsste.  Dies ist nicht allein unser Sieg, sondern eine Entscheidung für mehr Demokratie, Transparenz und Pluralismus. Durch den Beschluss wird eine Verbesserung der Situation für alle Kleinparteien und somit eine Verbesserung der politischen Vielfalt und des demokratischen Prozesses nun möglich. Auch die Wählerinnen und Wähler profitieren davon, da ihnen nun auch Parteien angezeigt werden müssen, mit denen sie mehr Übereinstimmungen haben, ohne, dass diese ihnen aufgrund eines umständlichen und intransparenten Auswahlverfahrens verborgen bleiben. Wir freuen uns gemeinsam mit allen auf eine spannende Wahl unter fairen Bedinungen!  Weitere Informationen zu diesem Thema findet ihr hier: www.voltdeutschland.org/aktuelles",https://www.facebook.com/VoltDeutschland/photos/a.142697006281027/421608501723208/?type=3,375,270,1530,1220,99,8,12,16,175
620,https://www.facebook.com/DiePARTEI/posts/2201059063263443,DiePARTEI,2019-05-20T07:00:48Z,photo,"NA",https://www.facebook.com/MartinSonnebornEU/photos/a.665725823489212/2328348360560275/?type=3,46,20,1328,1019,35,2,272,0,0
621,https://www.facebook.com/DiePARTEI/posts/2201283886574294,DiePARTEI,2019-05-20T10:32:16Z,link,"NA",https://www.heise.de/tp/news/Keine-Chance-fuer-Sprechblasen-4425550.html,6,28,531,446,17,1,67,0,0
622,https://www.facebook.com/FDP/posts/10157265966702250,FDP,2019-05-20T07:03:00Z,photo,"Unvernünftiges Wirtschaften und übermäßige Verschuldung einzelner EU-Mitgliedstaaten 🇪🇺 sind in einer Währungsunion stets unsolidarisch, weil sie allen Mitgliedstaaten schaden. 😤 Alle Staaten müssen mehr Verantwortung übernehmen und sich an die gemeinsam beschlossenen Regeln halten. So erhalten wir eine starke und stabile Gemeinschaftswährung. 💪  Ein stabiler Euro ist Voraussetzung für Wachstum und Wohlstand in Europa. Daher wollen wir das stabilitätsorientierte Regelwerk von Maastricht robuster machen: 1️⃣ Automatische Sanktionen nach Defizitverfahren 2️⃣ Auszahlung von Mitteln an die Einhaltung des Fiskalpakts knüpfen 3️⃣ Einführung nicht finanzieller Sanktionen, wie Aussetzung des Stimmrechts 👍  #ChancenNutzen 🚀 #EP2019 #Europawahl2019",https://www.facebook.com/FDP/photos/a.82276712249/10157265953122250/?type=3,49,34,277,244,12,2,18,0,1
623,https://www.facebook.com/CSU/posts/10157164363180688,CSU,2019-05-20T20:30:46Z,photo,#Klartext von Bayerns Ministerpräsident und CSU-Chef Markus Söder beim „Gipfeltreffen Europa“ in der ARD: Rechtspopulisten überall in Europa muss die rote Karte gezeigt werden.,https://www.facebook.com/CSU/photos/a.311521140687/10157164363140688/?type=3,242,47,1033,613,9,8,291,6,106
624,https://www.facebook.com/oedp.de/posts/10157233963684568,oedp.de,2019-05-20T12:07:12Z,video,Agnes Becker am verganenen Freitag bei Ihrer Ansprache zur Ehrung von @EdEDITION F. Danke für den tollen Abend und diese grandiose Motivation!,https://www.facebook.com/oedp.de/videos/396049584322699/,0,14,34,34,0,0,0,0,0
625,https://www.facebook.com/freie.waehler.bundesvereinigung/posts/1279322758886414,freie.waehler.bundesvereinigung,2019-05-20T18:00:01Z,photo,"Welttag der Biene  Heute am 2. Welttag der Biene lenkt die UNO die Aufmerksamkeit auf die Bienen und deren elementare Bedeutung als Bestäuberinsekten. Ohne echten Kurswechsel in der Umweltpolitik werden wir Bienen und andere Insekten nicht retten können. Wir FREIE WÄHLER haben die Zeichen der Zeit erkannt und in Bayern eines der umfangreichsten Artenschutzgesetze Europas auf den Weg gebracht.   Darüberhinaus appellieren wir an Städte und Gemeinden sowie an alle Bürgerinnen und Bürger, im Rahmen ihrer Möglichkeiten Wegränder, Bahnböschungen und Verkehrsinseln als neue Heimat für Biene Maja und Co. aufzuwerten. Denn Arten- und Umweltschutz sind eine gesamtgesellschaftliche Aufgabe. #UnsereHeimatEuropa",https://www.facebook.com/freie.waehler.bundesvereinigung/photos/a.204390103046357/1279321968886493/?type=3,0,21,59,58,1,0,0,0,0
626,https://www.facebook.com/SPD/posts/10156415848927749,SPD,2019-05-20T14:38:37Z,video,#EuropaistdieAntwort gegen Lohndumping und für gute Arbeitsbedingungen. Deshalb setzen wir die Entsenderichtlinie jetzt um.  Heißt: Gleicher Lohn für gleiche Arbeit am gleichen Ort. So sieht ein soziales Europa aus.,https://www.facebook.com/SPD/videos/1204474476403861/,574,167,629,249,7,1,53,0,319
627,https://www.facebook.com/B90DieGruenen/posts/10158317069423219,B90DieGruenen,2019-05-20T07:07:00Z,photo,"Keine #Bienen = keine Lebensmittel! Wir brauchen dringend eine andere Landwirtschaftspolitik, die gegen das #Bienensterben kämpft und auf Ackergifte verzichtet. Zeigt Euren Support und teilt das Bild! 🐝",https://www.facebook.com/B90DieGruenen/photos/a.103764373218/10158317066283219/?type=3,39,118,227,209,17,0,1,0,0
628,https://www.facebook.com/Piratenpartei/posts/10157342944807783,Piratenpartei,2019-05-20T19:15:07Z,photo,"Nachdem die Bundeszentrale für politische Bildung (bpb) aufgrund einer Entscheidung des Verwaltungsgerichts Köln die Wahl-O-Mat Seite vorerst abgeschaltet hat, bieten wir PIRATEN eine Alternative zur Europawahl an: den Geil-O-Mat unter www.geil-o-mat.eu. Schaut einfach mal rein und probiert es aus.  #wahlomat #geilomat #PIRATEN #Bundeszentrale",https://www.facebook.com/Piratenpartei/photos/a.10151623600487783/10157342944712783/?type=3,28,101,263,132,13,0,118,0,0
629,https://www.facebook.com/VoltDeutschland/posts/421537091730349,VoltDeutschland,2019-05-20T13:24:26Z,photo,Reformieren statt zerstören!  Miteinander statt gegeneinander!  Was würdest du gerne verbessern an der EU? Was ist deine Idee? Teile deine Ideen gerne mit uns - denn Volt steht für #IdeenStattGemecker!💜🇪🇺  #votevolt #jetztbistdudran #jointhechange,https://www.facebook.com/VoltDeutschland/photos/a.148220289062032/421536881730370/?type=3,22,37,332,303,25,0,4,0,0
630,https://www.facebook.com/oedp.de/posts/10157233754404568,oedp.de,2019-05-20T09:59:00Z,photo,"Aus anderen Ländern Profit ziehen und sich dann wundern, wenn die Menschen aufbrechen, um an unserem Wohlstand teilzuhaben? Das passt nicht zusammen! Wir sind überzeugt, dass es faire #Handelsbeziehungen auf Augenhöhe braucht, damit in den Ländern des globalen Südens das Leben wieder attraktiver wird.   Mit Ihrer Stimme für die #ÖDP und Prof. Dr. Klaus #Buchner als unserem Spitzenkandidaten bei der #Europawahl2019 stärken Sie uns im Einsatz für fairen Handel.  www.wenigeristmehr.jetzt  #Wirtschaft #Handel #MERCOSUR #EPA #Freihandelsabkommen #wählengehen #thistimeimvoting",https://www.facebook.com/oedp.de/photos/a.393610334567/10157233754404568/?type=3,3,34,102,102,0,0,0,0,0
631,https://www.facebook.com/DiePARTEI/posts/2201039056598777,DiePARTEI,2019-05-20T06:38:42Z,photo,Smiley,https://www.facebook.com/DiePARTEIOberfranken/photos/a.1508842806095484/2218243855155372/?type=3,51,95,2077,1494,91,5,487,0,0
632,https://www.facebook.com/Piratenpartei/posts/10157342245792783,Piratenpartei,2019-05-20T16:00:00Z,photo,"+++ PIRATEN Positionen +++ Sicherheit in Freiheit +++  Rechtswidrige und exzessive Überwachungsmaßnahmen stellen eine ernsthafte Gefahr dar. Es besteht ein sofortiger Handlungsbedarf, um den Generalverdacht gegen die eigene Bevölkerung aufzuheben und dami",https://www.facebook.com/Piratenpartei/photos/a.10157324934617783/10157324935107783/?type=3,0,8,31,31,0,0,0,0,0
633,https://www.facebook.com/B90DieGruenen/posts/10158323345703219,B90DieGruenen,2019-05-20T10:08:00Z,photo,"In fast jedem Supermarkt. Leider in unseren Meeren. Und leider auch in vielen Möwen: Die Plastiktüte. 73 Prozent der Deutschen wollen #Plastiktüten aus Supermärkten verbannen. Wir auch. Unterstützt uns dabei und teilt das Bild. Wählt am Sonntag GRÜN. Für die Meere, die Möwen, für Euch!",https://www.facebook.com/B90DieGruenen/photos/a.103764373218/10158323343988219/?type=3,51,97,422,394,18,0,5,2,3
634,https://www.facebook.com/CDU/posts/10156376629530415,CDU,2019-05-20T06:00:01Z,photo,Wir wählen Sicherheit. Sie auch?  #unserEuropa 🇪🇺 #26MaiCDU ⭐️,https://www.facebook.com/CDU/photos/a.438118535414/10156376649350415/?type=3,437,78,811,525,15,0,204,2,65
635,https://www.facebook.com/SPD/posts/10156416023082749,SPD,2019-05-20T15:55:40Z,photo,"In dieser Woche feiern wir 70 Jahre #Grundgesetz. Wir lassen das Grundgesetz für sich selbst sprechen und starten mit Artikel 5. Die Ereignisse in Österreich zeigen, wie wichtig der Einsatz von JournalistInnen und wie unverzichtbar #Pressefreiheit für die Demokratie ist. #Strache",https://www.facebook.com/SPD/photos/a.73469452748/10156416020927749/?type=3,133,176,560,481,23,1,48,1,6
636,https://www.facebook.com/oedp.de/posts/10157233371079568,oedp.de,2019-05-20T05:07:01Z,photo,"Auch in diversen Berliner U-Bahn-Stationen heißt es ""weniger ist mehr"" 😀  #Europawahl2019 - #wenigeristmehr  www.wenigeristmehr.jetzt",https://www.facebook.com/oedp.de/photos/a.393610334567/10157233371079568/?type=3,14,27,220,214,5,1,0,0,0
637,https://www.facebook.com/DiePARTEI/posts/2201951979840818,DiePARTEI,2019-05-20T18:56:42Z,photo,"NA",https://www.facebook.com/Wahlkampftour/photos/a.354580798308577/696068597493127/?type=3,2,3,204,189,11,0,4,0,0
638,https://www.facebook.com/DiePARTEI/posts/2202054449830571,DiePARTEI,2019-05-20T20:25:16Z,photo,"NA",https://www.facebook.com/MartinSonnebornEU/photos/a.665725823489212/2329328220462289/?type=3,88,166,3276,2601,194,4,476,0,1
639,https://www.facebook.com/alternativefuerde/posts/2424585334238458,alternativefuerde,2019-05-20T05:23:00Z,video,"+++ Frank Magnitz, MdB: »Seit fast 74 Jahren herrscht die SPD in Bremen: Diese Bastion muss fallen!« +++  Am 26. Mai geht es neben einem guten Ergebnis für die AfD Bremen auch darum, die Alleinherrschaft der SPD zu beenden.  Der Landesvorsitzende und Spitzenkandidat zur Bürgerschaftswahl Frank Magnitz will dabei das Ergebnis von 2015 deutlich übertreffen.  Hier stellt er sich und seine politischen Ziele für die schöne Hansestadt kurz vor: Vor allem die Verbesserung der Bildung und der Infrastruktur - insbesondere des Verkehrsflusses - liegt ihm am Herzen.  Ebenfalls im Video sehen Sie Thomas Jürgewitz, den stellvertretenden Landesvorsitzenden und Spitzenkandidaten für Bremerhaven.  ➡ Am 26. Mai AfD wählen!  Hier das Video auf YouTube: https://www.youtube.com/watch?v=iNWZRNj28Q4",https://www.facebook.com/afd.bremen/videos/361906471110442/,98,139,1247,1191,44,3,6,0,3
640,https://www.facebook.com/FDP/posts/10157267835542250,FDP,2019-05-20T11:44:23Z,photo,"#Strache: Der FPÖ-Skandal ist über Österreich hinaus eine Mahnung  ""Der Vorgang ist über Österreich 🇦🇹 hinaus eine deutliche Mahnung, dass viele, die die Werte und Institutionen unserer Demokratie bekämpfen oder verächtlich machen, vor allem ganz eigennützige Absichten verfolgen. Der falsche Patriotismus, den viele Rechtspopulisten vor sich hertragen, ist hier erstmals in voller Schäbigkeit entlarvt worden. Es ist nicht patriotisch oder freiheitlich, sein eigenes Land, seine Presse oder seine öffentlichen Aufträge an fremde Mächte zu verkaufen. Und ich glaube, dass das kein Einzelfall ist. Das sollten sich alle klarmachen, die kommenden Sonntag zur Wahl aufgerufen sind"", so Linda Teuteberg.  #ChancenNutzen 🚀 #EP2019 #Europawahl2019",https://www.facebook.com/FDP/photos/a.82276712249/10157267819867250/?type=3,124,111,854,800,23,2,27,0,2
641,https://www.facebook.com/DiePARTEI/posts/2201773826525300,DiePARTEI,2019-05-20T16:41:27Z,link,‪Waaaas? Wieso klagt Volt gegen den WAHLOMAT? Die sind ja spaßfeindlich... Hier eine schnelle Alternative Ihrer Lieblingspartei:,https://www.welcheparteisollichwaehlen.de/,41,124,647,516,33,4,94,0,0
642,https://www.facebook.com/CDU/posts/10156378482130415,CDU,2019-05-20T21:05:43Z,photo,"Annegret Kramp-Karrenbauer erinnert zum Abschluss des #Gipfeltreffens an Robert Schuman:  Europa ist eine große Vision, aber es braucht auch die konkrete Tat.  Gemeinsam kämpfen CDU und CSU (Christlich-Soziale Union) für ein starkes Europa, das Sicherheit, Frieden und Wohlstand schafft. 👉 Die Formel für die Zukunft lautet: #26MaiCDU   #unserEuropa 🇪🇺",https://www.facebook.com/CDU/photos/a.438118535414/10156378477410415/?type=3,334,47,557,382,10,4,112,1,48
643,https://www.facebook.com/FDP/posts/10157267633022250,FDP,2019-05-20T09:34:04Z,photo,"Wort halten, Soli abschaffen! Wenn der Solidarpakt 2019 endet, muss auch der Soli auslaufen. Seit 2011 übersteigen die Soli-Einnahmen die jährlichen Ausgaben aus dem Solidarpakt. Somit ist die Abschaffung eine Frage der politischen Glaubwürdigkeit.  ""Der #Soli muss spätestens zum 1. Januar 2020 abgeschafft werden – das zeigt unser verfassungsrechtliches Gutachten. Wer den Soli nicht abschafft, bricht also nicht nur sein Wort, sondern riskiert auch den Verfassungsbruch. Zeit, Bürgerinnen und Bürger endlich zu entlasten!"", so Christian Lindner.  #ChancenNutzen 🚀",https://www.facebook.com/FDP/photos/a.82276712249/10157267629057250/?type=3,131,154,1213,1166,24,5,15,0,3
644,https://www.facebook.com/VoltDeutschland/posts/337297983647454,VoltDeutschland,2019-05-21T10:42:43Z,video,Wie im vorigen Livestream der Pressekonferenz angekündigt folgt hier noch ein Update des Vorstands von Volt Deutschland zur Situation rund um den Wahl-O-Mat. 💜🇪🇺 #votevolt,https://www.facebook.com/VoltDeutschland/videos/337297983647454/,18,16,113,101,6,0,1,3,2
645,https://www.facebook.com/linkspartei/posts/10155853486410683,linkspartei,2019-05-21T08:34:24Z,video,"Der Fall Strache hat es noch einmal deutlich gemacht: Niemand braucht im Europaparlament Menschenfeinde, Rassisten und Lobbyisten der Superreichen. Martin Schirdewan, unser Spitzenkandidat zur Europawahl, warnt eindringlich vor einem Erstarken der Rechtsparteien.",https://www.facebook.com/linkspartei/videos/559015164625439/,97,141,526,459,17,1,47,0,2
646,https://www.facebook.com/VoltDeutschland/posts/431466947643452,VoltDeutschland,2019-05-21T16:27:05Z,video,💜🇪🇺 Wir melden uns live aus Berlin und dürfen Ronja von Rönne bei uns begrüßen. Wir freuen uns auf ein spannendes Gespräch!,https://www.facebook.com/VoltDeutschland/videos/431466947643452/,44,16,394,346,34,3,7,1,3
647,https://www.facebook.com/CDU/posts/10156380920905415,CDU,2019-05-21T20:57:21Z,photo,"Das war bei #wiegehtsEuropa heute Abend im ZDF das letzte TV-Duell vor der #Europawahl2019: Unser Spitzenkandidat Manfred Weber hat erneut gezeigt, dass er der richtige Mann für #unserEuropa ist. Jetzt kommt es auf uns alle an! Die nächsten 5 Tage sind entscheidend. Die meisten Menschen in Deutschland entscheiden erst jetzt, wo sie am Sonntag ihr Kreuz machen. Jetzt ist jede einzelne Stunde bis zur Schließung der Wahllokale eine Chance für jede und jeden von uns, Menschen anzusprechen und für die CDU zu werben. Für ein starkes und handlungsfähiges Europa, das sich um die großen Fragen kümmert: Um Wohlstand, Sicherheit und Frieden. Für ein Europa, in dem Deutschland eine gute Zukunft hat. #26MaiCDU",https://www.facebook.com/CDU/photos/a.438118535414/10156380901960415/?type=3,326,48,758,521,15,1,176,5,40
648,https://www.facebook.com/VoltDeutschland/posts/422195111664547,VoltDeutschland,2019-05-21T19:34:18Z,video,"Unser SpitzenkandidatDamian Boeselager zu Gast bei Jung & Naiv ! 🇪🇺💜  Mit seinem Interview-Format 'Jung & Naiv' richtet sich Journalist Tilo Jung vor allem an junge Menschen und diejenigen, die politisch bisher nicht besonders interessiert waren: Er selbst beschreibt es als 'Politik für Desinteressierte'.  Damian stand Tilo Jung im Rahmen seines Interviews in Berlin Rede und Antwort zu grundlegenden Fragen rund um sich selbst und die Partei:  Was will Volt, was andere nicht wollen? Wie ist das Wahl- und Parteiprogramm zustande gekommen? Wie finanzieren sich Volt ? In welchen EU-Ländern tritt Volt an? Warum soll Europa zu einer ""neuen Wirtschaftsmacht"" werden? Neben vielen weiteren Themen geht es in dem Interview unter anderem auch um die Herausforderungen, die Volt europäisch meistern will und um unsere Visionen für Europa - schaut unbedingt rein!    Das Interview findet ihr unter:  https://www.youtube.com/watch?v=4hNUEUj3Aq0&t=154s  Den Bericht auf dem Blog von Jung & Naiv unter:  http://www.jungundnaiv.de/2019/05/21/volt-spitzenkandidat-parteigruender-damian-boeselager-folge-416/  #votevolt #jointhechange #jetztbistdudran #EP2019",https://www.youtube.com/watch?v=4hNUEUj3Aq0&t=154s,3,33,197,184,11,1,0,0,1
