id,URL,party,timestamp,type,message,link,comments_count,shares_count,reactions_count,like_count,love_count,wow_count,haha_count,sad_count,angry_count
409,https://www.facebook.com/Piratenpartei/posts/10157324066257783,Piratenpartei,2019-05-13T12:08:39Z,photo,"Wir PIRATEN sind bei aktuellen Umfragen für die Europawahl am 26.05. in Berlin bei 3%. Danke für die Unterstützung. Da geht noch was nach oben! Aber denkt daran: Bei der Europawahl gibt es keine 5%-, sondern nur eine rechnerische Hürde. Keine Stimme ist verloren, also PIRATEN wählen!",https://www.facebook.com/PiratenparteiDeutschland/photos/a.10151623600487783/10157324066177783/?type=3,38,107,309,275,19,5,8,1,1
410,https://www.facebook.com/linkspartei/posts/10155864172300683,linkspartei,2019-05-13T13:21:49Z,video,"Gegen die globale Erwärmung helfen nicht warme Worte, sondern nur entschiedenes Handeln im Sinne des Klimaschutzes. Aber mit dieser Bundesregierung wird das nicht passieren. DIE LINKE streitet für mutigen Klimaschutz, europaweit. Es braucht Sofortmaßnahmen, um die drängendsten Probleme anzugehen. Die Parteivorsitzende Katja Kipping hat deshalb unseren 5-Punkte-Plan für den Klimaschutz vorgestellt. https://www.die-linke.de/start/nachrichten/detail/5-punkte-fuer-linken-klimaschutz/",https://www.facebook.com/linkspartei/videos/659413001137654/,75,28,205,173,2,0,14,3,13
411,https://www.facebook.com/B90DieGruenen/posts/10158302860238219,B90DieGruenen,2019-05-13T05:43:00Z,photo,Stell deine Fragen an Robert Habeck! Ab heute ist unser Bundesvorsitzender deutschlandweit für #Europa unterwegs. Auch in deiner Nähe: gruene.de/europa-wahlkampftour Teile unser Bild und verabrede dich mit deinen Freund*innen zu einem Townhall-Event in eurer Nähe!,https://www.facebook.com/B90DieGruenen/photos/a.103764373218/10158302856508219/?type=3,65,58,365,321,22,0,15,2,5
412,https://www.facebook.com/CDU/posts/381103035834174,CDU,2019-05-13T11:30:39Z,video,LIVE: Die Vorsitzende Annegret Kramp-Karrenbauer berichtet aus den Gremiensitzungen der @CDU.,https://www.facebook.com/CDU/videos/381103035834174/,101,25,170,122,7,3,15,0,23
413,https://www.facebook.com/alternativefuerde/posts/2413355785361413,alternativefuerde,2019-05-13T16:06:00Z,link,"++ ""Schutzbedürftige"" erstürmen erneut spanisches Festland und das mit aller Gewalt! ++  Beim größten Massenansturm der vergangenen sechs Monate auf Melilla sind Dutzende Flüchtlinge in die spanische Nordafrika-Exklave gelangt.  Sie alle versuchten, die rund sechs Meter hohen, doppelten Grenzzäune zu überklettern. Die Männer griffen die Grenzbeamten an, vier Polizisten wurden verletzt, ein Afrikaner wurde festgenommen. Mindestens 52 Personen im Invasoren-Modus gelang der Übertritt auf EU-Gebiet.  Unweigerlich fühlt man sich an den Angriff auf Ceuta im Oktober 2018 erinnert. Damals stürmten rund 200 Migranten die Exklave, attackierten mit Säure und Branntkalk die Polizisten. Es gab schwere Ausschreitungen mit vielen Verletzten. Die Medien berichteten kaum darüber. Die aggressiven Afrikaner leben seither mitten unter uns.  Die EU hat die Kontrolle über ihre Außengrenzen verloren. Daran besteht keinerlei Zweifel. Grenzpolizisten, die sich nicht einmal in schlimmer Bedrohungslage zur Wehr setzen dürfen, müssen sich niederrennen lassen. Von Autorität keine Spur, das spricht sich natürlich herum. Daher ist es nur eine Frage der Zeit, bis ein neuerlicher Überfall an der Grenze stattfindet und wir weitere Personen ""geschenkt"" bekommen. Höchste Eisenbahn also, Europa zur Festung zu machen!  https://www.gmx.net/magazine/politik/50-migranten-stuermen-spanische-nordafrika-exklave-33737472",https://www.gmx.net/magazine/politik/50-migranten-stuermen-spanische-nordafrika-exklave-33737472,622,1298,2893,708,3,44,67,46,2025
414,https://www.facebook.com/FDP/posts/337005703669613,FDP,2019-05-13T10:11:06Z,video,"🔴#LIVE: Christian Lindner, Nicola Beer und Linda Teuteberg präsentieren unserer Aktion mit den Liberal Democrats: Eine Plattform für Brieffreundschaften für Briten und Deutsche ➡️ https://www.bridging-brexit.eu/ 🇪🇺",https://www.facebook.com/FDP/videos/337005703669613/,35,18,158,146,10,0,1,0,1
415,https://www.facebook.com/oedp.de/posts/10157216649399568,oedp.de,2019-05-13T09:59:00Z,photo,Darum wähle ich #ÖDP: die ÖDP steht laut einer Umfrage zur EU-Wahl in Bayern bei 4 Prozent | #Europawahl2019 ÖDP wählen! | Keine 5-%-Hürde,https://www.facebook.com/oedp.de/photos/a.393610334567/10157216649399568/?type=3,5,45,189,175,11,3,0,0,0
416,https://www.facebook.com/DiePARTEI/posts/2191043217598361,DiePARTEI,2019-05-14T08:29:05Z,photo,"NA",https://www.facebook.com/MartinSonnebornEU/photos/a.182449111816888/2318112661583845/?type=3,118,106,3272,2013,165,1,1091,1,1
417,https://www.facebook.com/Piratenpartei/posts/10157325179147783,Piratenpartei,2019-05-14T09:49:00Z,video,Dr. Patrick Breyer spricht über das nicht mehr zeitgemäße Urheberrecht.  Wir PIRATEN wollen das Urheberrecht modernisieren. #Europawahl2019 #Gehtwählen,https://www.facebook.com/PiratenparteiDeutschland/videos/2292959777640025/,1,19,24,24,0,0,0,0,0
418,https://www.facebook.com/FamilienParteiDeutschlands/posts/2247331158695238,FamilienParteiDeutschlands,2019-05-14T20:26:04Z,photo,"Eine süße Stadt und ein toller Tag in Lübeck. Eltern und Großeltern informierten sich über unsere Partei und suchten das Gespräch mit unserem Spitzenkandidaten Helmut Geuking. Die Kinder und Enkelkinder nutzten die Zeit am Glücksrad und wurden fürs warten mit einer Zuckerwatte belohnt. Über 1000 Zuckerwatten und tolle Gespräche, wie soll es auch anders sein in der Marzipanstadt Lübeck. Morgen wird unser Spitzenkandidat Helmut Geuking Magdeburg besuchen und freut sich auf weitere interessante Gespräche!",https://www.facebook.com/FamilienParteiDeutschlands/photos/a.628202820608088/2247329188695435/?type=3,0,19,12,12,0,0,0,0,0
419,https://www.facebook.com/Piratenpartei/posts/10157326320952783,Piratenpartei,2019-05-14T11:06:48Z,link,"PIRATEN decken auf: Unser Spitzenkandidat zur Europawahl, Dr. Patrick Breyer, sorgt für mehr Transparenz bei der Polizei und geht gegen unzulässige Datenspeicherung vor.",https://www.kn-online.de/Nachrichten/Schleswig-Holstein/Demonstration-Patrick-Breyer-von-den-Piraten-kritisiert-Landespolizei,0,28,28,27,0,0,0,0,1
420,https://www.facebook.com/Piratenpartei/posts/10157325819842783,Piratenpartei,2019-05-14T04:21:25Z,photo,"NA",https://www.facebook.com/PiratenparteiDeutschland/photos/a.10157324934617783/10157324937907783/?type=3,5,23,61,61,0,0,0,0,0
421,https://www.facebook.com/CSU/posts/10157148194080688,CSU,2019-05-14T14:04:14Z,link,"#Klartext von Bayerns Ministerpräsident und CSU-Chef Markus Söder vor dem heutigen Koalitionsausschuss: Wir müssen den grundlegenden Kurs der Koalition neu bestimmen. Mit Blick auf die nachlassende Konjunktur reicht es nicht, nur hier und da ein bisschen nachzubessern. Die Große Koalition braucht gerade jetzt ein klares ökonomisches Update.",https://www.spiegel.de/politik/deutschland/markus-soeder-ueber-die-groko-alle-projekte-muessen-auf-den-pruefstand-a-1267389.html,33,10,159,116,0,1,38,0,4
422,https://www.facebook.com/DiePARTEI/posts/2190923537610329,DiePARTEI,2019-05-14T06:39:25Z,photo,Smiley.,https://www.facebook.com/DiePARTEINRW/photos/a.115645895138848/2169407793095971/?type=3,18,35,824,663,27,1,131,2,0
423,https://www.facebook.com/VoltDeutschland/posts/418301995387192,VoltDeutschland,2019-05-14T14:30:56Z,photo,"Paneuropäisch sind wir.  Pragmatisch handeln wir.  Progressiv sind unsere Ziele. Wir lassen das Schubladendenken hinter uns.  Uns geht es darum Probleme zu lösen, unsere Zukunft selbst in die Hand zu nehmen und zwar gemeinsam, mit einem europäischen Grundsatzprogramm auf das wir national und lokal aufbauen.  🇪🇺  #jetztbistdudran #votevolt #EP2019",https://www.facebook.com/VoltDeutschland/photos/a.142697006281027/418301868720538/?type=3,4,47,252,246,3,2,1,0,0
424,https://www.facebook.com/linkspartei/posts/10155864433600683,linkspartei,2019-05-14T07:00:01Z,link,"""Wir wollen, dass auch Google, Amazon und Co. endlich Steuern zahlen."" Unsere Spitzenkandidatin Özlem Alev Demirel im Kandidatencheck des ARD Morgenmagazin.",https://www.ardmediathek.de/ard/player/Y3JpZDovL2Rhc2Vyc3RlLmRlL21vcmdlbm1hZ2F6aW4vNTlhZTI2MzMtNThiNC00M2RkLWFkMjEtMTY4ZjIwNjdiMzNk/kandidatencheck-linke-spitzenkandidatin-oezlem-demirel,36,41,415,387,13,0,14,0,1
425,https://www.facebook.com/CSU/posts/10157148211005688,CSU,2019-05-14T15:01:00Z,photo,Heute starten die Beratungen zum Bayerischen Doppelhaushalt 2019/20 im Bayerischen Landtag. Wir setzen ein klares Zeichen für mehr Bildung und investieren in die Zukunft unserer Kinder.,https://www.facebook.com/CSU/photos/a.311521140687/10157148210040688/?type=3,21,18,109,88,0,0,21,0,0
426,https://www.facebook.com/freie.waehler.bundesvereinigung/posts/1274594186025938,freie.waehler.bundesvereinigung,2019-05-14T18:00:01Z,photo,"FREIE WÄHLER für eine mittelstandsfreundliche Wirtschaftspolitik in der EU  Häufig können Großkonzerne EU-Regeln unproblematisch bewältigen, während kleine und mittelständische Unternehmen die Last der Auflagen kaum stemmen können. Wir setzen uns für eine Regulierung ein, die den Rahmenbedingungen des deutschen und europäischen Mittelstands gerecht wird und ihn vor überbordender Bürokratie aus Brüssel schützt.  Lesen Sie unsere gesamten Vorhaben für einen starken Mittelstand hier: https://www.unsereheimateuropa.de/unsere-politik/innovationen/  #UnsereHeimatEuropa",https://www.facebook.com/freie.waehler.bundesvereinigung/photos/a.204390103046357/1274593229359367/?type=3,4,40,54,54,0,0,0,0,0
427,https://www.facebook.com/Piratenpartei/posts/10157326266842783,Piratenpartei,2019-05-14T10:27:47Z,link,"Unser Spitzenkandidat zur Europawahl 2019, Dr. Patrick Breyer, vorgestellt von Norddeutscher Rundfunk. Schaut rein und lernt ihn ein bisschen besser kennen.","https://www.ndr.de/nachrichten/schleswig-holstein/Patrick-Breyer-Piraten-Kandidat-fuer-die-Europawahl,europawahl574.html",2,15,33,33,0,0,0,0,0
428,https://www.facebook.com/VoltDeutschland/posts/418221062061952,VoltDeutschland,2019-05-14T11:22:57Z,video,"Heute morgen wurden wir im Morgenmagazin der ARD vorgestellt:  http://mediathek.daserste.de/Morgenmagazin/Volt-fordern-gemeinsame-europäische-Regi/Video?bcastId=435054&documentId=62726874  Unser gemeinsames Wahlprogramm die 'Amsterdam Deklaration', mit dem wir in acht Ländern zur Europawahl antreten, findet Ihr unter:  www.voltdeutschland.org/programm  #jetztbistdudran #EP2019 #votevolt 💜",http://mediathek.daserste.de/Morgenmagazin/Volt-fordern-gemeinsame-europäische-Regi/Video?bcastId=435054&documentId=62726874,1,28,211,198,12,1,0,0,0
429,https://www.facebook.com/CSU/posts/10157148200805688,CSU,2019-05-14T18:19:00Z,photo,Bayern investiert in Sicherheit! Neben 1.000 neuen Stellen für die Bayerische Polizei wird im Doppelhaushalt 2019/2020 das Budget für Einsatz- und Betriebsmittel der Polizei deutlich erhöht.,https://www.facebook.com/CSU/photos/a.311521140687/10157148200170688/?type=3,112,59,778,672,8,3,91,1,3
430,https://www.facebook.com/CDU/posts/333046224077046,CDU,2019-05-14T12:41:50Z,video,"LIVE aus dem Reichstag: Annegret Kramp-Karrenbauer mit dem CSU-Vorsitzenden Markus Söder, dem Fraktionsvorsitzenden Ralph Brinkhaus und Landesgruppenchef Alexander Dobrindt. #26MaiCDU",https://www.facebook.com/CDU/videos/333046224077046/,96,12,146,89,8,0,14,2,33
431,https://www.facebook.com/FDP/posts/10157252624967250,FDP,2019-05-14T11:46:41Z,video,"Am 26. Mai 2019 ist Europawahl. 🇪🇺 Ihr habt da schon was vor? Dann schaut Euch unser #Briefwahl-#Tutorial an! Svenja erklärt Euch in unserem nicht ganz ernst gemeinten Video, wie Ihr Euren Wunschsonntag verbringen und gleichzeitig wählen könnt. 💪  Übrigens: Im wirklichen Leben ist Svenja Hahn keine Möchtegern-Influencerin, sondern kandidiert auf Platz 2 der FDP-Liste zur Europawahl (Hier erfahrt Ihr mehr über sie: svenjailona-hahn.europa.fdp.de). Mit unserem Video-Tutorial möchten wir Euch dazu ermuntern, an der Wahl teilzunehmen – gerne auch per Briefwahl. Noch mehr freuen wir uns natürlich, wenn Ihr die Freien Demokraten wählt 😉Hier erfahrt Ihr noch mehr über die Briefwahl: fdp.de/briefwahl. Und hier könnt Ihr Euch über das Programm der Freien Demokraten zur Europawahl informieren: fdp.de/chancen-nutzen 👍 #ChancenNutzen 🚀 #govote2019 #diesmalwaehleich #Europawahl2019 #EP2019",https://youtu.be/TzXX8aESUs0,40,42,120,86,16,1,14,1,2
432,https://www.facebook.com/oedp.de/posts/10157218542389568,oedp.de,2019-05-14T05:07:01Z,photo,"Lisa Stemmer, Listenplatz 7 auf unserer Kandidatenliste zur #Europawahl, positioniert sich gegen #Uploadfilter.   #Europawahl2019 #ÖDP wählen! - Keine 5-%-Hürde!  www.wenigeristmehr.jetzt",https://www.facebook.com/oedp.de/photos/a.393610334567/10157218542389568/?type=3,0,11,45,45,0,0,0,0,0
433,https://www.facebook.com/DiePARTEI/posts/2190524027650280,DiePARTEI,2019-05-14T09:57:00Z,photo,"Unsere Kandidierenden für das Europäische Parlament stellen sich vor. Heute: Daniel Harms  Können diese Augen Lügen?  Oh ja, das können sie!  Bis heute hat sich der arbeitsscheue Tunichtgut Daniel Harms durch sein Leben gemogelt, ohne auch nur einen einzigen Tag einer geregelten Arbeit nachgegangen zu sein, wobei er die doch recht bescheidenen Zuwendungen des Staates mit verschiedensten Gaunereien aufstockte. Zum Beispiel als:  Hütchenspieler, Sektenguru, Heiratsschwindler, Enkel-Trick-Betrüger, Schutzgelderpresser und Immobilienmakler - dies sind nur einige Stationen in der kriminellen Vita dieses gewieften Tausendsassas.  Seinen hochgradig asozialen Lifestyle möchte Daniel Harms auch als Abgeordneter des Europäischen Parlaments weiterführen und seine exorbitanten Lebenshaltungskosten künftig vor allem mit den Schmiergeldern dubioser Lobbyisten decken.  Sie fragen sich jetzt bestimmt: ""Warum sollte ich einer derartigen Drecksau meine Stimme geben?""  Nunja: zumindest bezüglich seiner politischen Ziele ist Daniel Harms im Gegensatz zu den allermeisten Politikern ausnahmsweise mal ehrlich. Oder hat er auch da gelogen?  Finden Sie es heraus!",https://www.facebook.com/DiePARTEI/photos/a.121303877905649/2190520544317295/?type=3,164,85,2120,1441,86,4,589,0,0
434,https://www.facebook.com/FDP/posts/10157252451497250,FDP,2019-05-14T09:49:38Z,photo,"Gegenseitige Spionage unter europäischen Partnern 🇪🇺widerspricht der EU-Grundrechtscharta, den Regeln des Binnenmarktes und vor allem einem vertrauensvollen Umgang miteinander.👍  Unsere Lösung: Ein No-Spy-Abkommen zwischen den Mitgliedstaaten der Europäischen Union. Dadurch verpflichten sich alle Mitglieder der EU, sich nicht gegenseitig auszuspionieren. 💪  #ChancenNutzen 🚀 #EP2019 #Europawahl2019",https://www.facebook.com/FDP/photos/a.82276712249/10157252440557250/?type=3,25,12,158,136,9,2,10,0,1
435,https://www.facebook.com/alternativefuerde/posts/2400366983326960,alternativefuerde,2019-05-14T13:26:00Z,video,"+++ Kandidaten-Check zur EU-Wahl: Bernhard Zimniok (Listenplatz 5) +++  Bernhard Zimniok ist in seinem Leben weit herumgekommen und hatte die Chance, die Welt kennenzulernen. Er arbeitete für die Deutsche Botschaft in Damaskus/Syrien und in Islamabad/Pakistan als Referent Politik und war Mitglied im Board of Directors im ISOI Islamabad.  Privat ist er seit 43 Jahren verheiratet und hat einen erwachsenen Sohn. Im Anschluss an seine Lehre als Radio- und Fernsehtechniker, erwarb er das Abitur auf dem zweiten Bildungsweg und studierte Nachrichtentechnik bei der Bundeswehr mit den Abschlüssen Dipl.-Ing. (FH) Elektrotechnik und Ing. (FH) Arbeitssicherheit. Nach 15 Jahren aktivem Truppendienst schied Zimniok als Oberstleutnant aus. Nach seinem internationalen Engagement gründete er eine eigene GmbH mit Schwerpunkt Behördengeschäfte, Consulting im Bereich Kryptotechnik, Software für Großprojekte militärischer und ziviler Art und die Durchführung von Private-Partnership-Projekten im Bereich Photovoltaik und Wasserkraftwerke in West- und Ostafrika.   Zimniok ist Mitglied in der AfD seit 2015 und Mitglied im Landesfachausschuss ‚Außen-, Sicherheits-, Migrations- und Entwicklungspolitik‘ sowie im Landesfachausschuss ‚Innen-, Rechts- und Datenschutzpolitik, Asyl/Zuwanderung, Integration, Islam‘. Seine Expertise wird ein großer Zugewinn für das Europaparlament sein. Doch lernen Sie unseren Kandidaten im Video am besten selbst kennen.  Hier die YouTube-Version: https://www.youtube.com/watch?v=q3mnFmgk3FE  JETZT unseren YouTube-Kanal abonnieren: https://www.youtube.com/channel/UCq2rogaxLtQFrYG3X3KYNww/about?sub_confirmation=1   Hier finden Sie alle Infos zur Europawahl und unseren Kandidaten: ➡ https://www.afd.de/europawahl ➡ https://www.afd.de/europawahl-kandidaten  Profilbilder und Header: ➡ https://www.afd.de/werbematerial/",https://www.facebook.com/alternativefuerde/videos/324077528290876/,86,659,1373,1313,36,10,7,0,7
436,https://www.facebook.com/VoltDeutschland/posts/418416078709117,VoltDeutschland,2019-05-14T18:50:19Z,video,"Der nächste Stop auf unserem Roadtrip führt uns mit unseren Kandidaten Marie-Isabelle Heiss, Felice Maltzahn und Dr. Tobias Lechtenfeld nach Heidelberg! Wir möchten nicht alles verraten, nur so viel: Es wird bunt! Genauer gesagt, lila! 💜🇪🇺  #roadtrip #votevolt #jetztbistdudran #EP2019 #EuropeanElections #Europawahl #jointhechange",https://www.facebook.com/VoltDeutschland/videos/441793379983826/,28,58,247,232,11,2,1,0,1
437,https://www.facebook.com/oedp.de/posts/10157219403919568,oedp.de,2019-05-14T15:50:04Z,link,Bienenretter starten #EBI gegen das #Artensterben - jetzt vorab registrieren!  www.wesavebees.eu #Europawahl2019,https://www.oedp.de/aktuelles/pressemitteilungen/newsdetails/news/oedp-setzt-eu-beim-artenschutz-unter-druck-vorregi/,3,37,102,101,1,0,0,0,0
438,https://www.facebook.com/VoltDeutschland/posts/418160658734659,VoltDeutschland,2019-05-14T08:50:13Z,photo,"Get to know us! Heute: Evelyn Steffens Evelyn findet: "" Wir brauchen konstruktive Zusammenarbeit statt innerer Zerrissenheit. Wenn Europa zusammenhält, werden wir gemeinsam mehr erreichen, als je zuvor!""  Genau das ist unser Ziel: ein vereinigtes Europa, in dem wir die Herausforderungen der Zukunft gemeinsam meistern werden! 💜🇪🇺 #GetToKnowUs #EP2019 #votevolt",https://www.facebook.com/VoltDeutschland/photos/a.142697006281027/418159338734791/?type=3,2,10,123,119,4,0,0,0,0
439,https://www.facebook.com/DiePARTEI/posts/2191165504252799,DiePARTEI,2019-05-14T10:16:40Z,link,"NA",https://www.derwesten.de/politik/martin-sonneborn-schiesst-im-interview-hart-gegen-dieter-nuhr-scheinkabarettist-id217465871.html,40,430,1399,1231,132,1,35,0,0
440,https://www.facebook.com/FamilienParteiDeutschlands/posts/2247271408701213,FamilienParteiDeutschlands,2019-05-14T19:31:24Z,photo,"NA",https://www.facebook.com/R.Piekenbrock/photos/a.1924134794541087/2318365791784650/?type=3,0,5,7,7,0,0,0,0,0
441,https://www.facebook.com/B90DieGruenen/posts/10158314787228219,B90DieGruenen,2019-05-14T17:14:24Z,photo,Zum Beispiel mit CO2-Preis und Energiegeld. Mit Kohleausstieg und Verkehrswende. Es ist Zeit!,https://www.facebook.com/B90DieGruenen/photos/a.103764373218/10158314782843219/?type=3,125,146,1130,1029,52,0,37,2,10
442,https://www.facebook.com/CSU/posts/10157148270525688,CSU,2019-05-14T16:31:00Z,photo,"#Klartext von Bayerns Ministerpräsident und CSU-Chef Markus Söder bei SPIEGEL ONLINE:  Wir müssen den grundlegenden Kurs der Koalition neu bestimmen. Mit Blick auf die nachlassende Konjunktur reicht es nicht, nur hier und da ein bisschen nachzubessern.",https://www.facebook.com/CSU/photos/a.311521140687/10157148432490688/?type=3,26,11,197,138,2,4,53,0,0
443,https://www.facebook.com/CSU/posts/10157147700115688,CSU,2019-05-14T08:07:09Z,photo,"Raus zu den Menschen, so muss Europa sein: Unser Spitzenkandidat Manfred Weber begeisterte gestern bei der CSU-Kundgebung in der Oberpfalz.",https://www.facebook.com/manfred.weber/photos/a.607854129252955/2300751946629823/?type=3,47,7,220,110,1,3,74,2,30
444,https://www.facebook.com/SPD/posts/10156401919217749,SPD,2019-05-14T12:19:25Z,video,"Jedes Café, jede Bäckerei und jede Buchhandlung zahlt mehr Steuern als Starbucks, Amazon und Co! Damit muss Schluss sein. Internationale Konzerne müssen ihren angemessenen Beitrag leisten! Deshalb: Weltweite Mindestbesteuerung – jetzt! #EuropaistdieAntwort",https://www.facebook.com/katarina.barley/videos/742480902813247/,124,62,452,408,9,4,26,1,4
445,https://www.facebook.com/FDP/posts/10157252117957250,FDP,2019-05-14T07:03:00Z,photo,"#Sanktionen: Die innenpolitischen Entwicklungen in einigen EU-Staaten beobachten wir mit Sorge. Die EU 🇪🇺 ist auf gemeinsame Werte wie Menschenwürde, Freiheit, Demokratie, Gleichheit, Rechtsstaatlichkeit und die Wahrung der Menschenrechte gestützt, die für jedes Mitglied verbindlich sind. 👍 Deshalb treten wir bei deren Verletzung entschieden für den Entzug von Stimmrechten als Sanktion ein. 💪 Gleichzeitig wollen wir Artikel 7 EUV weiterentwickeln, um andere Sanktionsarten zu ermöglichen.  #ChancenNutzen 🚀 #EP2019 #Europawahl2019",https://www.facebook.com/FDP/photos/a.82276712249/10157252112187250/?type=3,62,20,214,189,12,0,11,1,1
446,https://www.facebook.com/tierschutzpartei/posts/2325713694117808,tierschutzpartei,2019-05-14T16:20:00Z,photo,"Lange Zeit galt es als ausgemachte Sache, dass Krebstiere keinen Schmerz spüren. Zu unterentwickelt sei ihr Nervensystem, die Tiere seien nur zu Reflexen fähig. Es wäre schön, wenn diese Annahme der Wahrheit entsprechen würde, denkt man daran, wie Hummer bei lebendigem Leib in heißem Wasser gekocht werden. Die Forschung erzielte aber bereits Ergebnisse, die in eine ganz andere Richtung deuten. So wurden in Experimenten beispielsweise die Fühler von Garnelen mit Säure gereizt, woraufhin die Tiere begannen, diese zu reiben. Waren die Fühler zuvor betäubt worden, zeigte sich keine Reaktion. Auch bei einer schmerzhaften Injektion begannen Krebse, das betroffene Körperteil am Boden zu scheuern. Am aussagekräftigsten allerdings war ein Versuch mit Gemeinen Strandkrabben. Die Tiere wurden in die Mitte eines erleuchteten Aquariums gesetzt, woraufhin sie Schutz suchten an den abgedunkelten Seiten. Sie taten dies, um sich instinktiv den bestmöglichen Schutz vor Fressfeinden wie Möwen zu sichern. In dem Versuch aber bekamen die Tiere, sobald sie in den dunklen Bereichen saßen, Stromstöße verabreicht. Schon nach zwei Versuchsdurchläufen hatten die Tiere gelernt, dass im Dunkeln ein Stromstoß drohte und trotz des starken Dranges, sich vor Fressfeinden zu schützen, blieben die Strandkrabben im Hellen. Offensichtlich empfanden sie den Stromstoß als so sehr unangenehm, dass sie die Angst im Licht bevorzugten. Damit glich ihr Verhalten dem von Wirbeltieren. Als wirbellose Tiere aber haben Hummer, Langusten und Taschenkrebse bisher keinerlei Rechte. Tierschutzbestimmungen gelten für sie nicht. Mit fortschreitender Erkenntnis ist allerdings auch die Einstellung des Menschen zu Krustentieren im Wandel. In der Schweiz, Großbritannien und Neuseeland ist es inzwischen vorgeschrieben, beispielsweise Hummer vor dem Kochen zu betäuben. Wie weit die Tiere gehen, um dem Schmerz zu entgehen, illustriert ein Video, das im Juni 2018 viral ging: ein kleiner Flusskrebs schnitt sich seine eigene Schere ab, um dem Kochtopf zu entkommen. Da das Potenzial für Leiden ganz offensichtlich gegeben ist, muss der Umgang mit Krustentieren in der Lebensmittelindustrie neu überdacht werden. Fang, Lagerung, Transport und Tötung sind keinesfalls artgerecht. Allein an Hummern werden jedes Jahr 250 Millionen Tiere gefangen, es geht insgesamt um das Wohl von Milliarden von Krustentieren.",https://www.facebook.com/Tierschutzpartei/photos/a.125553314133868/2325713234117854/?type=3,17,96,270,98,1,0,0,129,42
447,https://www.facebook.com/linkspartei/posts/10155866205475683,linkspartei,2019-05-14T15:13:21Z,photo,"Heute wurde der Kapitän des Seenotrettungsschiffs ""Lifeline"", Claus-Peter Reisch, zu einer Geldstrafe von 10.000 Euro verurteilt. Warum? Weil er Menschen vor dem Ertrinken rettete. So verliert Europa seine Seele. Wir sagen: Stoppen wir das Sterben im Mittelmeer, schaffen wir sichere Fluchtwege und verbieten wir den Export von Waffen!",https://www.facebook.com/linkspartei/photos/a.10151604354715683/10155866205400683/?type=3,259,826,2517,1610,12,8,33,520,334
448,https://www.facebook.com/FDP/posts/10157254374452250,FDP,2019-05-15T07:03:00Z,photo,"#Vorratsdatenspeicherung: Ein Generalverdacht hat noch kein Verbrechen verhindert❗️  Mehr gespeicherte Daten schaffen nicht mehr Sicherheit. Sinnvoller ist es, Gefährder gezielt zu identifizieren und lückenlos zu überwachen. 👍 Dabei sind nicht fehlende Daten, sondern fehlendes Personal das Problem. Wir sagen Nein zu jeder anlasslosen Erhebung und Speicherung von personenbezogenen Daten unbescholtener Bürgerinnen und Bürgern in der gesamten EU 🇪🇺. Ob bei Telefonaten, Versenden von SMS-Nachrichten oder Nutzung des Internets – die Bürgerinnen und Bürger müssen die Gewissheit haben, dass Daten nicht massenhaft gespeichert und ausgewertet werden können.💪 #ChancenNutzen 🚀 #EP2019 #Europawahl2019 #VDS #NeinzuVDS",https://www.facebook.com/FDP/photos/a.82276712249/10157254367827250/?type=3,16,16,160,151,8,0,1,0,0
449,https://www.facebook.com/oedp.de/posts/10157222039224568,oedp.de,2019-05-15T18:38:00Z,link,"Morgen Abend, 20.15 Uhr, diskutiert unsere Spitzenkandidatin Manuela Ripa mit Jo Leinen und Roland Theis live im #Saartalk:",https://www.sr.de/sr/fernsehen/sendungen_a_-_z/uebersicht/saartalk/index.html,0,5,32,32,0,0,0,0,0
